,Company,Source,Author,Title,URL,Publish_Date
1792,PAYC,Biztoc.com,investors.com,"S&P 500: Crashing Bank Stock, Dow Giant Lead Losers",https://biztoc.com/x/edc9a0cee9e834dd,2023-03-21T00:12:21Z
1793,PAYC,Biztoc.com,investors.com,"S&P 500: Crashing Bank Stock, Dow Giant Lead Losers",https://biztoc.com/x/aacee85f79ed3097,2023-03-20T20:54:05Z
1794,PAYC,Biztoc.com,investors.com,"S&P 500: Crashing Bank Stock, Dow Giant Lead Losers",https://biztoc.com/x/9620e36fb5e8bb3a,2023-03-20T21:38:08Z
1795,PAYC,Biztoc.com,investors.com,S&P 500 Losers: First Republic Crashes; Dow Giant Microsoft Slides,https://biztoc.com/x/76c1e0da7e64e3fe,2023-03-20T20:46:20Z
1796,PYPL,MarketWatch,Christine Idzelis,Market Extra: U.S. stock market sectors reclassified with big shifts to financials from tech,https://www.marketwatch.com/story/u-s-stock-market-sectors-reclassified-with-big-shifts-to-financials-from-tech-517c0767,2023-03-20T14:34:00Z
1797,PYPL,MarketWatch,Christine Idzelis,Market Extra: Why financials may become the ‘new crowded’ sector after looming classification changes in stock market,https://www.marketwatch.com/story/why-financials-may-become-the-new-crowded-sector-after-looming-classification-changes-in-stock-market-e7e9b217,2023-03-07T21:34:00Z
1798,PYPL,Motley Fool,newsfeedback@fool.com (Justin Pope),Is PayPal Holdings Stock a Buy?,https://www.fool.com/investing/2023/03/10/is-paypal-holdings-stock-a-buy/,2023-03-10T14:19:38Z
1799,PYPL,Motley Fool,newsfeedback@fool.com (Matthew DiLallo),How to Invest in PayPal Stock,https://www.fool.com/investing/how-to-invest/stocks/how-to-invest-in-paypal-stock/,2023-03-31T19:11:48Z
1800,PYPL,Motley Fool,newsfeedback@fool.com (Jon Quast),Is PayPal Stock a Buy Now?,https://www.fool.com/investing/2023/03/19/is-paypal-stock-a-buy-now/,2023-03-19T11:44:00Z
1801,PNR,Yahoo Entertainment,TipRanks,"Half of the global population could face water scarcity by 2025, according to UNICEF. Here are 2 water treatment stocks to watch now",https://finance.yahoo.com/news/half-global-population-could-face-001714629.html,2023-03-23T00:17:14Z
1802,PNR,Marketscreener.com,MarketScreener,Pentair Earns 2023 ENERGY STAR® Partner of the Year – Sustained Excellence Award,https://www.marketscreener.com/quote/stock/PENTAIR-PLC-16656327/news/Pentair-Earns-2023-ENERGY-STAR-Partner-of-the-Year-ndash-Sustained-Excellence-Award-43358658/?utm_medium=RSS&utm_content=20230328,2023-03-28T14:05:02Z
1803,PNR,Plos.org,"Yuting Lei, Yuwei Huang, Ke Yang, Xueya Cao, Yuzhao Song, Enrique Martín-Blanco, José Carlos Pastor-Pareja",FGF signaling promotes spreading of fat body precursors necessary for adult adipogenesis in Drosophila,https://journals.plos.org/plosbiology/article?id=10.1371/journal.pbio.3002050,2023-03-22T14:00:00Z
1804,PNR,MarketWatch,MarketWatch Automation,Company Close Updates: Pentair PLC stock outperforms market on strong trading day,https://www.marketwatch.com/data-news/pentair-plc-stock-outperforms-market-on-strong-trading-day-c67371bc-ab27b07b9210,2023-03-14T21:20:39Z
1805,PEP,Business Insider,amartin@insider.com (Asia Martin),Meta's big job cuts aren't about the tricky economy or rising inflation. They're about Mark Zuckerberg's mistakes.,https://www.businessinsider.com/metas-job-cuts-are-about-mark-zuckerbergs-mistakes-2023-3,2023-03-14T22:18:42Z
1806,PEP,Motley Fool,newsfeedback@fool.com (Reuben Gregg Brewer),Why PepsiCo Is a Better Dividend Stock Than Coca-Cola,https://www.fool.com/investing/2023/03/02/why-pepsico-is-a-better-dividend-stock-than-coca-c/,2023-03-02T11:20:00Z
1807,PEP,Motley Fool,"newsfeedback@fool.com (Parkev Tatevosian, CFA)",Best Dividend Stock: Deer vs. Pepsi vs. Target vs. Procter & Gamble,https://www.fool.com/investing/2023/03/23/best-dividend-stock-deer-vs-pepsi-vs-target-vs-pro/,2023-03-23T12:00:00Z
1808,PEP,Motley Fool,newsfeedback@fool.com (Kody Kester),Is This Warren Buffett Stock a Buy After Its Dividend Boost?,https://www.fool.com/investing/2023/03/04/is-this-warren-buffett-stock-a-buy-coca-cola/,2023-03-04T14:45:00Z
1809,PEP,Motley Fool,newsfeedback@fool.com (Adam Spatacco),Wall Street Thinks This Stock Could Rise Over 30%,https://www.fool.com/investing/2023/03/24/wall-street-thinks-this-stock-could-rise-over-30/,2023-03-24T12:27:00Z
1810,PKI,Marketscreener.com,MarketScreener,WISeKey SEALSQ Launches Trusted Matter Security/Certificate Services for IoT Devices,https://www.marketscreener.com/quote/stock/WISEKEY-INTERNATIONAL-HOL-26786298/news/WISeKey-SEALSQ-Launches-Trusted-Matter-Security-Certificate-Services-for-IoT-Devices-43383163/?utm_medium=RSS&utm_content=20230330,2023-03-30T13:18:02Z
1811,PKI,Marketscreener.com,MarketScreener,WISeKey SEALSQ Launches Trusted Matter Security/Certificate Services for IoT Devices,https://www.marketscreener.com/quote/stock/WISEKEY-INTERNATIONAL-HOL-26786298/news/WISeKey-SEALSQ-Launches-Trusted-Matter-Security-Certificate-Services-for-IoT-Devices-43383164/?utm_medium=RSS&utm_content=20230330,2023-03-30T13:18:02Z
1812,PKI,Marketscreener.com,MarketScreener,Rezolute KOL Event Highlights Significant Unmet Medical Need in Diabetic Macular Edema,https://www.marketscreener.com/quote/stock/REZOLUTE-INC-114862310/news/Rezolute-KOL-Event-Highlights-Significant-Unmet-Medical-Need-in-Diabetic-Macular-Edema-43324830/?utm_medium=RSS&utm_content=20230323,2023-03-23T20:51:02Z
1813,PKI,Marketscreener.com,MarketScreener,Rezolute KOL Event Highlights Significant Unmet Medical Need in Diabetic Macular Edema,https://www.marketscreener.com/quote/stock/REZOLUTE-INC-114862310/news/Rezolute-KOL-Event-Highlights-Significant-Unmet-Medical-Need-in-Diabetic-Macular-Edema-43324829/?utm_medium=RSS&utm_content=20230323,2023-03-23T20:51:02Z
1814,PKI,Marketscreener.com,MarketScreener,WISeKey Further Expands its North American Footprint with the Signing of a Sales Representative Partnership with CJR Associates,https://www.marketscreener.com/quote/stock/WISEKEY-INTERNATIONAL-HOL-26786298/news/WISeKey-Further-Expands-its-North-American-Footprint-with-the-Signing-of-a-Sales-Representative-Part-43326297/?utm_medium=RSS&utm_content=20230324,2023-03-24T06:01:01Z
1815,PFE,Forbes,"Trefis Team, Contributor, 
 Trefis Team, Contributor
 https://www.forbes.com/sites/greatspeculations/people/trefis/",Is Pfizer Stock Undervalued At $40?,https://www.forbes.com/sites/greatspeculations/2023/03/17/is-pfizer-stock-undervalued-at-40/,2023-03-17T13:00:00Z
1816,PFE,Forbes,"Trefis Team, Contributor, 
 Trefis Team, Contributor
 https://www.forbes.com/sites/greatspeculations/people/trefis/",This Logistics Company Appears To Be A Better Pick Over Pfizer Stock,https://www.forbes.com/sites/greatspeculations/2023/03/13/this-logistics-company-appears-to-be-a-better-pick-over-pfizer-stock/,2023-03-13T11:00:14Z
1817,PFE,Motley Fool,newsfeedback@fool.com (Keith Speights),Why Seagen Stock Is Soaring Today,https://www.fool.com/investing/2023/03/13/why-seagen-stock-is-soaring-today/,2023-03-13T15:48:27Z
1818,PFE,Motley Fool,newsfeedback@fool.com (David Jagielski),"If You Invested $25,000 in Pfizer in 2020, This Is How Much You Would Have Today",https://www.fool.com/investing/2023/03/30/if-invested-25k-pfizer-2020-how-much-today/,2023-03-30T09:40:00Z
1819,PFE,Biztoc.com,investors.com,BioNTech Stock Crumbles After 2023 Outlook Misses By Almost $3 Billion,https://biztoc.com/x/4011becacd9e659a,2023-03-27T13:52:06Z
1820,PCG,Yahoo Entertainment,TipRanks,The US may be on the brink of a nuclear renaissance; Here are 2 stocks under $5 that stand to benefit,https://finance.yahoo.com/news/us-may-brink-nuclear-renaissance-145603066.html,2023-03-15T14:56:03Z
1821,PCG,Yahoo Entertainment,Simply Wall St,PG&E Corporation's (NYSE:PCG) Intrinsic Value Is Potentially 27% Above Its Share Price,https://finance.yahoo.com/news/pg-e-corporations-nyse-pcg-144635311.html,2023-03-18T14:46:35Z
1822,PCG,Marketscreener.com,MarketScreener,"Petron : heeds call of DOE, assists in Mindoro Oil Spill",https://www.marketscreener.com/quote/stock/PETRON-CORPORATION-6491973/news/Petron-heeds-call-of-DOE-assists-in-Mindoro-Oil-Spill-43146272/?utm_medium=RSS&utm_content=20230303,2023-03-03T10:39:12Z
1823,PCG,GlobeNewswire,Robbins LLP,PG&E Corporation (PCG) Shareholder Alert: Robbins LLP Reminds Investors of Class Action Against PG&E Corporation,https://www.globenewswire.com/news-release/2023/03/27/2635219/32719/en/PG-E-Corporation-PCG-Shareholder-Alert-Robbins-LLP-Reminds-Investors-of-Class-Action-Against-PG-E-Corporation.html,2023-03-27T20:02:00Z
1824,PCG,Marketscreener.com,MarketScreener,PG&E Corporation Appoints Carolyn Burke as Executive Vice President and Chief Financial Officer,https://www.marketscreener.com/quote/stock/PG-E-CORPORATION-13946/news/PG-E-Corporation-Appoints-Carolyn-Burke-as-Executive-Vice-President-and-Chief-Financial-Officer-43255701/?utm_medium=RSS&utm_content=20230315,2023-03-15T20:18:03Z
1825,PM,The Guardian,Mark Sweney,UK chip designer Arm chooses US-only listing in blow to Rishi Sunak,https://www.theguardian.com/business/2023/mar/03/uk-chip-designer-arm-chooses-us-only-listing-in-blow-to-rishi-sunak,2023-03-03T09:32:08Z
1826,PM,BBC News,https://www.facebook.com/bbcnews,Rahul Gandhi: Congress holds countrywide protests over disqualification,https://www.bbc.co.uk/news/world-asia-india-65063615,2023-03-27T06:53:06Z
1827,PM,BBC News,https://www.facebook.com/bbcnews,Gandhi says disqualification 'politically motivated',https://www.bbc.co.uk/news/world-asia-india-65074804,2023-03-25T10:18:46Z
1828,PM,Techmeme.com,,"Source: Elon Musk offers Twitter staff stock grants at a ~$20B valuation which, with a $13B debt, implies a $33B enterprise value, ~11x 2023's projected revenue (Erin Woo/The Information)",https://www.techmeme.com/230325/p17,2023-03-26T03:45:04Z
1829,PM,Techmeme.com,,Stripe says it raised a $6.5B+ Series I at a $50B valuation to help its employees cover tax obligations related to RSUs and to fund a new stock tender offer (Dan Primack/Axios),https://www.techmeme.com/230315/p36,2023-03-15T21:05:00Z
1830,PSX,Yahoo Entertainment,Laura McCandless,Sliding Oil Stock Flashing Bull Signal,https://finance.yahoo.com/news/sliding-oil-stock-flashing-bull-185146704.html,2023-03-15T18:51:46Z
1831,PSX,Motley Fool,"newsfeedback@fool.com (Daniel Foelber, Scott Levine, and Lee Samaha)",3 High-Yield Dividend Stocks That Generate More Passive Income Than a 10-Year Treasury Note,https://www.fool.com/investing/2023/03/12/high-yield-dividend-stocks-10-year-treasury-note/,2023-03-12T10:00:00Z
1832,PSX,Biztoc.com,barchart.com,Phillips 66,https://biztoc.com/x/585d6ea00f30417f,2023-03-05T19:22:08Z
1833,PSX,Biztoc.com,marketbeat.com,Sliding Oil Stock Flashing Bull Signal,https://biztoc.com/x/6589f14a33694817,2023-03-16T13:14:31Z
1834,PSX,CNA,,Pakistan's Honda Atlas shuts production to end-March on import difficulties,https://www.channelnewsasia.com/business/pakistans-honda-atlas-shuts-production-end-march-import-difficulties-3334731,2023-03-08T15:39:51Z
1835,PNW,Business Insider,insider@insider.com (Perri Ormont Blumberg),"I make up to $9,500 a month renting out my home while my family lives in a trailer in the driveway. Here's how I set up my Airbnb and VRBO business.",https://www.businessinsider.com/airbnb-vrbo-make-9500-month-while-living-trailer-driveway-2023-3,2023-03-03T10:00:00Z
1836,PNW,Forbes,"Brett Owens, Contributor, 
 Brett Owens, Contributor
 https://www.forbes.com/sites/brettowens/",Don’t Drown In The Next Recession: Here Are 7 Life Preservers,https://www.forbes.com/sites/brettowens/2023/03/05/dont-drown-in-the-next-recession-here-are-7-life-preservers/,2023-03-05T14:38:00Z
1837,PNW,Thefly.com,,"Street Wrap: Today's Top 15 Upgrades, Downgrades, Initiations",https://thefly.com/permalinks/entry.php/id3679736/ROKU;MTCH;ARGX;GOLF;PNW;SGEN;PFE;XM;PRVB;SNY;ZEV;OVV;DKS;EL;ASO;HIBB;EHC-Street-Wrap-Todays-Top--Upgrades-Downgrades-Initiations,2023-03-14T13:48:41Z
1838,PNW,MarketWatch,MarketWatch Automation,"Company Close Updates: Pinnacle West Capital Corp. stock rises Tuesday, outperforms market",https://www.marketwatch.com/data-news/pinnacle-west-capital-corp-stock-rises-tuesday-outperforms-market-42d01fd1-0c1375e2afcc,2023-03-14T21:20:39Z
1839,PNW,MarketWatch,MarketWatch Automation,"Company Close Updates: Pinnacle West Capital Corp. stock falls Thursday, underperforms market",https://www.marketwatch.com/data-news/pinnacle-west-capital-corp-stock-falls-thursday-underperforms-market-f799d9b1-ed4edff1b4b9,2023-03-23T21:20:51Z
1840,PXD,Motley Fool,newsfeedback@fool.com (Matthew DiLallo),Why Pioneer Natural Resources Stock Slumped 13% in February,https://www.fool.com/investing/2023/03/06/why-pioneer-natural-resources-stock-slumped-13-in/,2023-03-06T18:50:05Z
1841,PXD,Motley Fool,newsfeedback@fool.com (Matthew DiLallo),3 Top Energy Stocks to Buy Before the Market Picks Up Again,https://www.fool.com/investing/2023/03/21/3-top-energy-stocks-to-buy-before-the-market-picks/,2023-03-21T12:44:00Z
1842,PXD,Motley Fool,newsfeedback@fool.com (George Budwell),Billionaire Money Managers Keep Buying These Incredibly Cheap High-Yield Dividend Stocks,https://www.fool.com/investing/2023/03/27/billionaire-money-managers-keep-buying-these-incre/,2023-03-27T13:15:00Z
1843,PXD,Motley Fool,newsfeedback@fool.com (Matthew DiLallo),3 Higher-Risk Dividend Stocks With Big Upside Potential,https://www.fool.com/investing/2023/03/14/3-higher-risk-dividend-stocks-with-big-upside-pote/,2023-03-14T11:28:00Z
1844,PXD,Motley Fool,newsfeedback@fool.com (Keith Speights),Should You Buy the 5 Highest-Paying Dividend Stocks in the S&P 500?,https://www.fool.com/investing/2023/03/12/buy-highest-paying-dividend-stocks-sp-500/,2023-03-12T09:50:00Z
1845,PNC,Business Insider,prosen@insider.com (Phil Rosen),Goldman Sachs just told us the banking crisis makes it more pessimistic about the economy - and other recession signals are blaring too,https://www.businessinsider.com/silicon-valley-bank-crisis-gives-reason-for-pessimism-in-the-economy-2023-3,2023-03-17T10:15:00Z
1846,PNC,Google News,,"PNC decides not to bid on Silicon Valley Bank as regulators struggle to find rescue buyers, source says - CNBC",https://consent.google.com/ml?continue=https://news.google.com/rss/articles/CBMif2h0dHBzOi8vd3d3LmNuYmMuY29tLzIwMjMvMDMvMTIvcG5jLWRlY2lkZXMtbm90LXRvLWJpZC1vbi1zaWxpY29uLXZhbGxleS1iYW5rLWFzLXJlZ3VsYXRvcnMtc3RydWdnbGUtdG8tZmluZC1yZXNjdWUtYnV5ZXJzLmh0bWzSAYMBaHR0cHM6Ly93d3cuY25iYy5jb20vYW1wLzIwMjMvMDMvMTIvcG5jLWRlY2lkZXMtbm90LXRvLWJpZC1vbi1zaWxpY29uLXZhbGxleS1iYW5rLWFzLXJlZ3VsYXRvcnMtc3RydWdnbGUtdG8tZmluZC1yZXNjdWUtYnV5ZXJzLmh0bWw?oc%3D5&gl=FR&hl=en-US&cm=2&pc=n&src=1,2023-03-12T21:40:47Z
1847,PNC,MarketWatch,Joy Wiltermuth,": Bank debt swoons as Fed moves to contain fallout from SBV, Signature Bank collapses",https://www.marketwatch.com/story/bank-debt-swoons-as-fed-moves-to-contain-fallout-from-sbv-signature-bank-collapses-9588e016,2023-03-13T23:27:00Z
1848,PNC,Motley Fool,newsfeedback@fool.com (Dave Kovaleski),Why US Bancorp Stock Was Down 15.1% This Week,https://www.fool.com/investing/2023/03/17/why-us-bancorp-stock-was-down-151-this-week/,2023-03-17T15:53:57Z
1849,PNC,MarketWatch,Philip van Doorn,Deep Dive: These stocks fared the worst as Powell pushed the market down Tuesday,https://www.marketwatch.com/story/these-stocks-fared-the-worst-as-powell-pushed-the-market-down-tuesday-1744d0a,2023-03-07T21:59:00Z
1850,POOL,The Guardian,Nils Pratley,John Lewis may find that cuddly co-investors don’t exist | Nils Pratley,https://www.theguardian.com/business/nils-pratley-on-finance/2023/mar/22/john-lewis-may-find-that-cuddly-co-investors-dont-exist,2023-03-22T06:00:18Z
1851,POOL,Business Insider,Jennifer Sor,"The bank failures have opened up Pandora's box, and the huge hole in banks' balance sheets isn't going away, strategist says",https://markets.businessinsider.com/news/stocks/us-banking-crisis-pandoras-box-recession-outlook-debt-financial-stress-2023-3,2023-03-30T19:06:21Z
1852,POOL,Ars Technica,Doug Johnson,North Sea cod are getting smaller—can we reverse that?,https://arstechnica.com/science/2023/03/north-sea-cod-are-getting-smaller-can-we-reverse-that/,2023-03-19T13:00:43Z
1853,POOL,Business Insider,insider@insider.com (Mary Hanbury),TJ Maxx says its assortment of discounted brands is better than ever thanks to store closures elsewhere. Here's how it keeps prices so low.,https://www.businessinsider.com/how-tj-maxx-keeps-its-prices-so-low-2023-3,2023-03-03T11:33:59Z
1854,POOL,Business Insider,prosen@insider.com (Phil Rosen),Silicon Valley Bank and inflation complicate the Fed’s next move,https://www.businessinsider.com/silicon-valley-bank-inflation-cpi-fed-rate-hike-signature-crisis-2023-3,2023-03-15T10:20:00Z
1855,PPG,Forbes,"Bruce Martin, Contributor, 
 Bruce Martin, Contributor
 https://www.forbes.com/sites/brucemartin-1/","Forty Years And More For PPG, Team Penske, And The Penske Corporation",https://www.forbes.com/sites/brucemartin/2023/03/31/forty-years-and-more-for-ppg-team-penske-and-the-penske-corporation/,2023-03-31T19:31:49Z
1856,PPG,Yahoo Entertainment,Simply Wall St,"What Is PPG Industries, Inc.'s (NYSE:PPG) Share Price Doing?",https://finance.yahoo.com/news/ppg-industries-inc-nyse-ppg-191146165.html,2023-03-27T19:11:46Z
1857,PPG,Yahoo Entertainment,Simply Wall St,The three-year decline in earnings might be taking its toll on PPG Industries (NYSE:PPG) shareholders as stock falls 8.3% over the past week,https://finance.yahoo.com/news/three-decline-earnings-might-taking-131123250.html,2023-03-12T13:11:23Z
1858,PPG,Fox Sports,John Fanta,NBA Draft guide to the NCAA Tournament: 20 top prospects to watch,https://www.foxsports.com/stories/college-basketball/nba-draft-guide-to-ncaa-tournament-20-players-to-watch-this-weekend,2023-03-15T21:46:55Z
1859,PPG,Yahoo Entertainment,Yahoo Sports,10 best NBA Draft prospects in the 2023 NCAA tournament,https://sports.yahoo.com/10-best-nba-draft-prospects-in-the-2023-ncaa-tournament-181835517.html,2023-03-13T18:18:35Z
1860,PPL,Yahoo Entertainment,PR Newswire,"PPL Corporation subsidiary Rhode Island Energy gains regulatory approval for $290 million to strengthen network safety, reliability and resilience",https://finance.yahoo.com/news/ppl-corporation-subsidiary-rhode-island-130800333.html,2023-03-30T13:08:00Z
1861,PPL,Marketscreener.com,MarketScreener,PPL Corporation remains confident in its Kentucky generation investment plans and overall business outlook despite Kentucky Senate Bill 4 becoming law,https://www.marketscreener.com/quote/stock/PPL-CORPORATION-14091/news/PPL-Corporation-remains-confident-in-its-Kentucky-generation-investment-plans-and-overall-business-o-43334279/?utm_medium=RSS&utm_content=20230324,2023-03-24T21:41:02Z
1862,PPL,Marketscreener.com,MarketScreener,PPL : Louisville Gas and Electric Company - Form 8-K,https://www.marketscreener.com/quote/stock/PPL-CORPORATION-14091/news/PPL-Louisville-Gas-and-Electric-Company-Form-8-K-43212740/?utm_medium=RSS&utm_content=20230310,2023-03-10T11:35:14Z
1863,PPL,Marketscreener.com,MarketScreener,PPL : Rhode Island Energy Customers To See Drop in Electricity Supply Prices Starting April 1,https://www.marketscreener.com/quote/stock/PPL-CORPORATION-14091/news/PPL-Rhode-Island-Energy-Customers-To-See-Drop-in-Electricity-Supply-Prices-Starting-April-1-43140275/?utm_medium=RSS&utm_content=20230302,2023-03-02T16:12:27Z
1864,PPL,Marketscreener.com,MarketScreener,Pakistan Petroleum : Credit of Interim Cash Dividend,https://www.marketscreener.com/quote/stock/PAKISTAN-PETROLEUM-LIMITE-6497800/news/Pakistan-Petroleum-Credit-of-Interim-Cash-Dividend-43344086/?utm_medium=RSS&utm_content=20230327,2023-03-27T05:48:03Z
1865,PFG,Investor's Business Daily,Investor's Business Daily,Analysts Warn Investors To Dump 10 Big Stocks Before It's Too Late,https://www.investors.com/etfs-and-funds/sectors/sp500-analysts-warn-investors-to-dump-big-stocks-before-its-too-late/,2023-03-20T12:00:46Z
1866,PFG,Yahoo Entertainment,Swati Goyal,10 Hot Growth Stocks To Buy Now,https://finance.yahoo.com/news/10-hot-growth-stocks-buy-230958244.html,2023-03-06T23:09:58Z
1867,PFG,Marketscreener.com,MarketScreener,"AM Best Affirms Credit Ratings of Principal Financial Group, Inc. and Its Subsidiaries",https://www.marketscreener.com/quote/stock/PRINCIPAL-FINANCIAL-GROUP-39051261/news/AM-Best-Affirms-Credit-Ratings-of-Principal-Financial-Group-Inc-and-Its-Subsidiaries-43263570/?utm_medium=RSS&utm_content=20230316,2023-03-16T13:47:02Z
1868,PFG,Marketscreener.com,MarketScreener,Principal® earns ENERGY STAR® Partner of the Year: Sustained Excellence Award for sixth consecutive year,https://www.marketscreener.com/quote/stock/PRINCIPAL-FINANCIAL-GROUP-39051261/news/Principal-earns-ENERGY-STAR-Partner-of-the-Year-Sustained-Excellence-Award-for-sixth-consecutive-43358610/?utm_medium=RSS&utm_content=20230328,2023-03-28T14:01:01Z
1869,PFG,Marketscreener.com,MarketScreener,Principal® Survey Identifies Leading Disruptors of Retirement Industry By 2030,https://www.marketscreener.com/quote/stock/PRINCIPAL-FINANCIAL-GROUP-39051261/news/Principal-Survey-Identifies-Leading-Disruptors-of-Retirement-Industry-By-2030-43293401/?utm_medium=RSS&utm_content=20230320,2023-03-20T15:31:02Z
1870,PG,Motley Fool,"newsfeedback@fool.com (Parkev Tatevosian, CFA)",Best Dividend Stock to Buy Now: Target vs. Procter & Gamble,https://www.fool.com/investing/2023/03/02/best-dividend-stock-to-buy-now-target-vs-procter-g/,2023-03-02T16:52:57Z
1871,PG,Hindenburgresearch.com,,Hindenburg Research Outs Block Inc as Fraud,https://hindenburgresearch.com/block/,2023-03-23T12:39:10Z
1872,PG,Forbes,"Trefis Team, Contributor, 
 Trefis Team, Contributor
 https://www.forbes.com/sites/greatspeculations/people/trefis/",Is Kimberly-Clark Stock A Better Pick Over Its Industry Peer?,https://www.forbes.com/sites/greatspeculations/2023/03/27/is-kimberly-clark-stock-a-better-pick-over-its-industry-peer/,2023-03-27T11:00:33Z
1873,PG,Motley Fool,"newsfeedback@fool.com (Parkev Tatevosian, CFA)",Best Dividend Stock: Deer vs. Pepsi vs. Target vs. Procter & Gamble,https://www.fool.com/investing/2023/03/23/best-dividend-stock-deer-vs-pepsi-vs-target-vs-pro/,2023-03-23T12:00:00Z
1874,PG,Motley Fool,newsfeedback@fool.com (Demitri Kalogeropoulos),Better Dividend Stock: Target vs. Procter & Gamble,https://www.fool.com/investing/2023/03/27/better-dividend-stock-target-vs-procter-gamble/,2023-03-27T09:15:00Z
1875,PGR,Motley Fool,newsfeedback@fool.com (Courtney Carlsen),Higher Interest Rates Gave This Growth Stock a Boost. Will It Continue?,https://www.fool.com/investing/2023/03/05/higher-interest-rates-gave-this-growth-stock-boost/,2023-03-05T13:21:00Z
1876,PGR,Yahoo Entertainment,Philippe GRELARD,Electro-pop master M83: 'We're losing the mystery in music'...,https://news.yahoo.com/electro-pop-master-m83-were-034033560.html,2023-03-21T10:40:38Z
1877,PGR,Biztoc.com,marketbeat.com,Lemonade Earnings Gap and Crap. Here’s Why,https://biztoc.com/x/cbed988adbe27d2e,2023-03-06T14:00:19Z
1878,PGR,Biztoc.com,marketbeat.com,3 Stocks Moving Higher on Analyst Upgrades,https://biztoc.com/x/1e71e7aed3e0e877,2023-03-17T13:16:11Z
1879,PGR,Biztoc.com,marketbeat.com,Diversify Your Income with These 2 High-Yielding Dividend ETFs,https://biztoc.com/x/f065877413699428,2023-03-14T11:02:08Z
1880,PLD,Motley Fool,newsfeedback@fool.com (Kody Kester),It's Not Too Late to Buy This Powerhouse Dividend Stock,https://www.fool.com/investing/2023/03/14/not-too-late-to-buy-powerhouse-dividend-stock/,2023-03-14T13:10:00Z
1881,PLD,Motley Fool,newsfeedback@fool.com (Matthew DiLallo),A Recession Won't Slow Down This Dynamic Dividend Stock,https://www.fool.com/investing/2023/03/03/a-recession-wont-slow-down-this-dynamic-dividend-s/,2023-03-03T13:13:00Z
1882,PLD,Yahoo Entertainment,Soumya Eswaran,Prologis (PLD): A Standout in the Sector,https://finance.yahoo.com/news/prologis-pld-standout-sector-081234151.html,2023-03-07T08:12:34Z
1883,PLD,Motley Fool,newsfeedback@fool.com (Matthew DiLallo),1 Real Estate Stock to Avoid Like the Plague (and 2 to Buy Instead),https://www.fool.com/investing/2023/03/08/1-real-estate-stock-to-avoid-like-the-plague-and-2/,2023-03-08T12:09:00Z
1884,PLD,Motley Fool,newsfeedback@fool.com (Matthew DiLallo),3 Elite Dividend Stocks Down 30%+ to Buy Right Now for Decades of Passive Income,https://www.fool.com/investing/2023/03/15/3-elite-dividend-stocks-down-30-to-buy-right-now-f/,2023-03-15T11:45:00Z
1885,PRU,Search Engine Journal,Mordy Oberstein,"Analyzing The February 2023 Product Review Update via @sejournal, @MordyOberstein",https://www.searchenginejournal.com/analyzing-the-february-2023-product-review-update/482985/,2023-03-27T09:00:13Z
1886,PRU,Motley Fool,newsfeedback@fool.com (James Brumley),The Best Dividend Stocks to Buy Right Now Could Be Hiding in Plain Sight,https://www.fool.com/investing/2023/03/16/the-best-dividend-stocks-to-buy-right-now/,2023-03-16T13:30:00Z
1887,PRU,Motley Fool,newsfeedback@fool.com (James Brumley),Adding $500 to These 3 Stocks Would Be a Genius Move Right Now,https://www.fool.com/investing/2023/03/21/adding-500-to-these-3-stocks-would-be-genius-move/,2023-03-21T12:55:04Z
1888,PRU,Moneycontrol,Chirag Mehta,Why using an ESG filter helps prevent stock market shocks,https://www.moneycontrol.com/news/business/personal-finance/why-using-an-esg-filter-helps-prevent-stock-market-shocks-10227401.html,2023-03-10T05:50:06Z
1889,PRU,Google News,,Trade setup for Friday: Top 15 things to know before the opening bell - Moneycontrol,https://consent.google.com/ml?continue=https://news.google.com/rss/articles/CBMiiAFodHRwczovL3d3dy5tb25leWNvbnRyb2wuY29tL25ld3MvYnVzaW5lc3MvbWFya2V0cy90cmFkZS1zZXR1cC1mb3ItZnJpZGF5LXRvcC0xNS10aGluZ3MtdG8ta25vdy1iZWZvcmUtdGhlLW9wZW5pbmctYmVsbC0yOC0xMDI2MjcxMS5odG1s0gGMAWh0dHBzOi8vd3d3Lm1vbmV5Y29udHJvbC5jb20vbmV3cy9idXNpbmVzcy9tYXJrZXRzL3RyYWRlLXNldHVwLWZvci1mcmlkYXktdG9wLTE1LXRoaW5ncy10by1rbm93LWJlZm9yZS10aGUtb3BlbmluZy1iZWxsLTI4LTEwMjYyNzExLmh0bWwvYW1w?oc%3D5&gl=FR&hl=en-US&cm=2&pc=n&src=1,2023-03-16T16:58:54Z
