,Company,Source,Author,Title,URL,Publish_Date
1202,IEX,Moneycontrol,Moneycontrol News,"NTPC, JSW Energy and Indian Energy Exchange to benefit from peak power demand: Jefferies",https://www.moneycontrol.com/news/business/markets/ntpc-jsw-energy-and-indian-energy-exchange-to-benefit-from-peak-power-demand-jefferies-10283851.html,2023-03-21T06:07:21Z
1203,IEX,The Times of India,ET Bureau,"Indian stocks to be flat & volatile for first 6 months of 2023, 10% Return likely in H2: Mugunthan Siva",https://economictimes.indiatimes.com/markets/expert-view/indian-stocks-to-be-flat-volatile-for-first-6-months-of-2023-10-return-likely-in-h2-mugunthan-siva/articleshow/98376477.cms,2023-03-03T00:57:22Z
1204,IEX,The Real Deal,Steven Dilakian,StubHub inks 44K sf lease at 3 World Trade Center,https://therealdeal.com/new-york/2023/03/07/stubhub-ditches-midtown-for-3-wtc/,2023-03-07T22:12:10Z
1205,IEX,The Times of India,ET Now,"Buy or Sell: Stock ideas by experts for March 16, 2023",https://economictimes.indiatimes.com/markets/stocks/news/buy-or-sell-stock-ideas-by-experts-for-march-16-2023/videoshow/98681829.cms,2023-03-16T03:22:20Z
1206,IEX,Marketscreener.com,MarketScreener,Indian Energy Exchange : IEX commences trade on High Price Day Ahead Market,https://www.marketscreener.com/quote/stock/INDIAN-ENERGY-EXCHANGE-LI-105516317/news/Indian-Energy-Exchange-IEX-commences-trade-on-High-Price-Day-Ahead-Market-43212678/?utm_medium=RSS&utm_content=20230310,2023-03-10T11:25:12Z
1207,IDXX,Yahoo Entertainment,Soumya Eswaran,Strong Q3 Results Pushed IDEXX Laboratories (IDXX) in Q4,https://finance.yahoo.com/news/strong-q3-results-pushed-idexx-113528413.html,2023-03-31T11:35:28Z
1208,IDXX,Yahoo Entertainment,Simply Wall St,"Should You Investigate IDEXX Laboratories, Inc. (NASDAQ:IDXX) At US$488?",https://finance.yahoo.com/news/investigate-idexx-laboratories-inc-nasdaq-120031426.html,2023-03-06T12:00:31Z
1209,IDXX,Motley Fool,newsfeedback@fool.com (Jeremy Bowman),Best Pet Food Stocks for Animal Lovers,https://www.fool.com/investing/stock-market/market-sectors/consumer-discretionary/retail-stocks/pet-food-stocks/,2023-03-10T21:01:25Z
1210,IDXX,MarketWatch,MarketWatch Automation,Company Close Updates: PerkinElmer Inc. stock outperforms market on strong trading day,https://www.marketwatch.com/data-news/perkinelmer-inc-stock-outperforms-market-on-strong-trading-day-9e225ebb-e4977502da86,2023-03-31T21:22:35Z
1211,IDXX,MarketWatch,Barbara Kollmeyer,"Here’s one for the battered bulls: the second-largest sector in the S&P 500 is stirring to life, says this strategist.",https://www.marketwatch.com/story/heres-one-for-the-battered-bulls-the-second-largest-sector-in-the-s-p-500-is-stirring-to-life-says-this-strategist-5e179744,2023-03-22T09:52:00Z
1212,ITW,Forbes,"Dividend Channel, Contributor, 
 Dividend Channel, Contributor
 https://www.forbes.com/sites/dividendchannel/","Ex-Dividend Reminder: TTEC Holdings, Deere And Illinois Tool Works",https://www.forbes.com/sites/dividendchannel/2023/03/28/ex-dividend-reminder-ttec-holdings-deere-and-illinois-tool-works/,2023-03-28T15:23:04Z
1213,ITW,Yahoo Entertainment,Simply Wall St,Is Illinois Tool Works Inc. (NYSE:ITW) Potentially Undervalued?,https://finance.yahoo.com/news/illinois-tool-works-inc-nyse-110018508.html,2023-03-20T11:00:18Z
1214,ITW,Biztoc.com,marketbeat.com,"Boring is Beautiful, Illinois Tool Works Stock Fits the Bill",https://biztoc.com/x/81ad35fb9905e8e5,2023-03-28T13:18:22Z
1215,ITW,Yahoo Entertainment,Insider Monkey Transcripts,"Lowe’s Companies, Inc. (NYSE:LOW) Q4 2022 Earnings Call Transcript",https://finance.yahoo.com/news/lowe-companies-inc-nyse-low-022952180.html,2023-03-03T02:29:52Z
1216,ITW,MarketWatch,MarketWatch Automation,"Company Close Updates: Snap-On Inc. stock falls Wednesday, underperforms market",https://www.marketwatch.com/data-news/snap-on-inc-stock-falls-wednesday-underperforms-market-37262a0f-55fa9017375a,2023-03-22T21:24:08Z
1217,ILMN,MarketWatch,Philip van Doorn,Deep Dive: These stocks fared the worst as Powell pushed the market down Tuesday,https://www.marketwatch.com/story/these-stocks-fared-the-worst-as-powell-pushed-the-market-down-tuesday-1744d0a,2023-03-07T21:59:00Z
1218,ILMN,Fintel.io,247patrick,Illumina Hits Back at Carl Icahn’s Grail Deal Claims and His Board Nominations,https://fintel.io/news/illumina-hits-back-at-carl-icahn-s-grail-deal-claims-and-board-nominations-in,2023-03-29T02:45:30Z
1219,ILMN,Yahoo Entertainment,Vandana Singh,"Binance Suspends Trading, European Bank Trouble, Twitter To Remove Legacy Verified Checkmarks: Today's Top Stories",https://finance.yahoo.com/news/binance-suspends-trading-european-bank-154448443.html,2023-03-24T15:44:48Z
1220,ILMN,Fintel.io,Fintel,Illumina Hits Back At Carl Icahn’s Grail Deal Claims And His Board Nominations,https://fintel.io/news/illumina-hits-back-at-carl-icahn-s-grail-deal-claims-and-board-nominations-in-latest-development-606?utm_source=valuewalk.com&utm_medium=referral&utm_campaign=illumina-hits-back-at-carl-icahn-s-grail-deal-claims-and-board-nominations-in-latest-development-606,2023-03-28T21:22:34Z
1221,ILMN,24/7 Wall St.,Paul Ausick,"Before the Bell: Regional Banks Recover, Icahn Moves on Illumina, Plus Gold and Bitcoin",https://247wallst.com/investing/2023/03/14/before-the-bell-regional-banks-recovering-icahn-moves-on-illumina-gold-and-bitcoin/,2023-03-14T11:34:29Z
1222,INCY,Biztoc.com,marketbeat.com,FDA Rejection Pushes Incyte Stock Sharply Lower,https://biztoc.com/x/4ec876c36d6df2cd,2023-03-27T13:24:59Z
1223,INCY,24/7 Wall St.,Lee Jackson,"Monday’s Top Analyst Upgrades and Downgrades: Altria, Block, Coinbase Global, Deere, First Horizon, KB Home, Pfizer, PNC Financial Services, RingCentral, Uber Technologies, Zoom Video Communications",https://247wallst.com/investing/2023/03/27/mondays-top-analyst-upgrades-and-downgrades-altria-block-coinbase-global-deere-first-horizon-kb-home-pfizer-pnc-financial-services-ringcentral-uber-technologies-zoom-video-communications/,2023-03-27T12:49:52Z
1224,INCY,24/7 Wall St.,Lee Jackson,"Tuesday’s Top Analyst Upgrades and Downgrades: Alphabet, Caterpillar, Corning, Dish Network, KeyCorp, Nvidia, Pinterest, Roku, Tesla, Wynn Resorts and More",https://247wallst.com/investing/2023/03/28/tuesdays-top-analyst-upgrades-and-downgrades-alphabet-caterpillar-corning-digital-realty-trust-dish-network-keycorp-nvidia-pinterest-roku-tesla-wynn-resorts/,2023-03-28T12:46:38Z
1225,INCY,Pypi.org,eppioes@gmail.com,pmenv added to PyPI,https://pypi.org/project/pmenv/,2023-03-04T12:55:23Z
1226,INCY,MarketWatch,Barbara Kollmeyer,"Why the stock market rally can keep going, says Wall Street strategist who only recently warned of a death zone.",https://www.marketwatch.com/story/why-the-stock-rally-can-keep-going-says-wall-street-strategist-who-only-recently-warned-of-a-death-zone-e51777e9,2023-03-06T11:49:00Z
1227,IR,MakeUseOf,David Rutland,4 Cheap Raspberry Pi Alternatives You Can Buy for Under $50,https://www.makeuseof.com/cheap-raspberry-pi-alternatives-under-50/,2023-03-12T15:30:16Z
1228,IR,Deadline,jillg366,"Paramount Global Taps Former Activision Blizzard, Snap IR Chief Kristin Southey To Head Investor Relations",https://deadline.com/2023/03/paramount-global-hires-former-activision-blizzard-snap-ir-chief-kristin-southey-investor-relations-chief-replacing-anthony-diclemente-1235311066/,2023-03-27T20:56:10Z
1229,IR,New Atlas,Paul Ridden,Desktop hand warmer uses focused IR LEDs to beat the chill,https://newatlas.com/around-the-home/varme-desktop-hand-warmer-ir-led/,2023-03-10T16:51:26Z
1230,IR,XDA Developers,João Carrasqueira,Lenovo ThinkPad T14 Gen 4 vs ThinkPad T14s Gen 4,https://www.xda-developers.com/lenovo-thinkpad-t14-gen-4-vs-thinkpad-t14s-gen-4/,2023-03-31T14:00:17Z
1231,IR,Yahoo Entertainment,Quebec Precious Metals Corporation,Quebec Precious Metals to Reveal Lithium Potential on James Bay Projects and Hires IR Firm Paradox,https://finance.yahoo.com/news/quebec-precious-metals-reveal-lithium-110000783.html,2023-03-27T11:00:00Z
1232,PODD,Yahoo Entertainment,Soumya Eswaran,Should You Hold Insulet Corporation (PODD)?,https://finance.yahoo.com/news/hold-insulet-corporation-podd-082710730.html,2023-03-03T08:27:10Z
1233,PODD,Yahoo Entertainment,Soumya Eswaran,Should You Invest in Insulet Corporation (PODD)?,https://finance.yahoo.com/news/invest-insulet-corporation-podd-060809921.html,2023-03-20T06:08:09Z
1234,PODD,Yahoo Entertainment,Soumya Eswaran,Multiple Reasons for the Outperformance of Insulet Corporation (PODD) in Q4,https://finance.yahoo.com/news/multiple-reasons-outperformance-insulet-corporation-121935643.html,2023-03-13T12:19:35Z
1235,PODD,Investor's Business Daily,Investor's Business Daily,"IBD Screen Of The Day: AMD, Chipotle Boast Rising Profit Estimates",https://www.investors.com/research/amd-stock-nears-latest-buy-point-chipotle-boasts-rising-profit-estimates/,2023-03-15T18:29:58Z
1236,PODD,MarketWatch,Claudia Assis,: Silicon Valley Bank out of S&P 500 index; Insulet selected to replace it,https://www.marketwatch.com/story/silicon-valley-bank-out-of-s-p-500-index-insulet-selected-to-replace-it-c9d954c8,2023-03-10T23:09:00Z
1237,INTC,CNN,Reuters,"Intel co-founder Gordon Moore, author of 'Moore's Law' that helped drive computer revolution, dies at 94",https://www.cnn.com/2023/03/24/tech/gordon-moore-obituary/index.html,2023-03-25T02:47:02Z
1238,INTC,Motley Fool,newsfeedback@fool.com (Neil Rozenbaum),The Surprising Reason Intel Stock Soared on Wednesday,https://www.fool.com/investing/2023/03/30/the-surprising-reason-intel-stock-soared-on-wednes/,2023-03-30T15:38:29Z
1239,INTC,Motley Fool,newsfeedback@fool.com (Jose Najarro),"Why AMD, Intel, and Nvidia Stock All Rallied on Thursday",https://www.fool.com/investing/2023/03/16/why-amd-intel-and-nvidia-stock-all-rallied-on-thur/,2023-03-16T21:36:16Z
1240,INTC,Motley Fool,newsfeedback@fool.com (Jose Najarro),Nvidia's Grace CPU: Time to Rethink AMD & Intel Stock Investment?,https://www.fool.com/investing/2023/03/23/nvidias-grace-cpu-time-to-rethink-amd-intel-stock/,2023-03-23T12:16:04Z
1241,INTC,Motley Fool,"newsfeedback@fool.com (Jose Najarro, Nicholas Rossolillo, and Billy Duberstein)","A PC Bull Market Could Be Coming, but Will AMD or Intel's Stock Be the Bigger Winner?",https://www.fool.com/investing/2023/03/25/a-pc-bull-market-could-be-coming-but-will-amd-or-i/,2023-03-25T17:43:11Z
1242,ICE,Business Insider,"avarma@insider.com (Anil Varma,Zinya Salfiti)","Fear of financial crisis unleashed chaos across markets this week. These 7 charts show how the shockwaves engulfed stocks, bonds, and commodities.",https://markets.businessinsider.com/news/stocks/svb-banking-crisis-financial-turmoil-stocks-volatility-bonds-oil-markets-2023-3,2023-03-17T10:09:03Z
1243,ICE,Business Insider,"gkay@insider.com (Grace Kay,Sindhu Sundar)",Read the email billionaire Ron Baron sent Elon Musk telling him to stop tweeting when angry: 'Get an ice cream cone. Just don't use Twitter',https://www.businessinsider.com/tesla-investor-ron-baron-email-elon-musk-dont-tweet-angry-2023-3,2023-03-10T09:42:00Z
1244,ICE,Business Insider,dsiu@insider.com (Diamond Naga Siu),The tech world is thrown into chaos as Silicon Valley loses faith in its go-to bank,https://www.businessinsider.com/florida-apple-instagram-netflix-tesla-software-airbnb-healthcare-2023-3,2023-03-10T11:40:00Z
1245,ICE,Business Insider,dsiu@insider.com (Diamond Naga Siu),Elemy is ditching autism care to sell healthcare software instead.,https://www.businessinsider.com/florida-apple-instagram-netflix-tesla-software-airbnb-healthcare-autism-2023-3,2023-03-10T11:40:00Z
1246,ICE,Vice News,"Adam Rothbarth, Gregory Babcock, Hilary Pollack",I Tried the Van Leeuwen Ranch Ice Cream (And Asked Chefs How They’d Eat It),https://www.vice.com/en/article/m7bj7x/ranch-flavored-ice-cream-hidden-valley-review,2023-03-20T21:07:57Z
1247,IFF,Marketscreener.com,MarketScreener,IFF Declares Dividend for First Quarter 2023,https://www.marketscreener.com/quote/stock/INTERNATIONAL-FLAVORS-F-13047/news/IFF-Declares-Dividend-for-First-Quarter-2023-43206754/?utm_medium=RSS&utm_content=20230309,2023-03-09T21:20:02Z
1248,IFF,Yahoo Entertainment,Alexandra Hudson and Tom Sims,"Swiss lawmakers tell Credit Suisse to clean up its act, seek to ringfence crisis",https://finance.yahoo.com/news/swiss-lawmakers-tell-credit-suisse-164618867.html,2023-03-17T16:46:18Z
1249,IFF,Biztoc.com,investors.com,"S&P 500: First Republic, Banks Lead Winners; Carnival, Google Are Monday Losers",https://biztoc.com/x/1dd83ff6b2d97437,2023-03-27T21:06:24Z
1250,IFF,Marketscreener.com,MarketScreener,IFF Recommends Stockholders Reject Mini-Tender Offer by TRC Capital Investment Corporation,https://www.marketscreener.com/quote/stock/INTERNATIONAL-FLAVORS-F-13047/news/IFF-Recommends-Stockholders-Reject-Mini-Tender-Offer-by-TRC-Capital-Investment-Corporation-43304257/?utm_medium=RSS&utm_content=20230321,2023-03-21T20:17:03Z
1251,IFF,Biztoc.com,thestreet.com,Comcast Makes Morningstar Undervalued Stock List,https://biztoc.com/x/e779abf91c7895b2,2023-03-30T19:08:09Z
1252,IP,Ars Technica,Benj Edwards,Ethical AI art generation? Adobe Firefly may be the answer,https://arstechnica.com/information-technology/2023/03/ethical-ai-art-generation-adobe-firefly-may-be-the-answer/,2023-03-22T17:27:41Z
1253,IP,Business Insider,bnguyen@insider.com (Britney Nguyen),"US would destroy Taiwan's semiconductor factories rather than letting them fall into China's hands, a former national security adviser says",https://www.businessinsider.com/us-would-destroy-taiwan-semiconductor-factories-avoid-china-trump-adviser-2023-3,2023-03-13T17:23:12Z
1254,IP,Fox News,Julia Musto,"Adobe launches AI program Firefly, including image generator",https://www.foxnews.com/tech/adobe-launches-artificial-intelligence-program-firefly-image-generator,2023-03-22T19:27:54Z
1255,IP,AppleInsider,news@appleinsider.com (William Gallagher),"New Adobe Firefly will use AI to generate art, but protect artists",https://appleinsider.com/articles/23/03/21/new-adobe-firefly-will-use-ai-to-generate-art-but-protect-artists,2023-03-21T14:42:05Z
1256,IP,Slickdeals.net,TheCryptkeeper,"64GB Apple 10.2"" iPad WiFi Tablet (2021 Model) $250 + Free Shipping",https://slickdeals.net/f/16508206-64gb-apple-10-2-ipad-wifi-tablet-2021-model-250-free-shipping,2023-03-22T20:02:18Z
1257,IPG,Yahoo Entertainment,Soumya Eswaran,What Makes The Interpublic Group of Companies (IPG) a Resilient Sock?,https://finance.yahoo.com/news/makes-interpublic-group-companies-ipg-080701438.html,2023-03-15T08:07:01Z
1258,IPG,Bloomberg,,Antics Keep Advertisers Away...,https://www.bloomberg.com/news/articles/2023-03-30/twitter-s-revenue-drops-amid-advertisers-concerns-over-elon-musk,2023-03-30T16:43:37Z
1259,IPG,Forbes,"Q.ai - Powering a Personal Wealth Movement, Contributor, 
 Q.ai - Powering a Personal Wealth Movement, Contributor
 https://www.forbes.com/sites/qai/",5 Artificial Intelligence ETFs For Investors To Ride The AI Wave - Plus One Bonus Alternative,https://www.forbes.com/sites/qai/2023/03/30/5-artificial-intelligence-etfs-for-investors-to-ride-the-ai-waveplus-one-bonus-alternative/,2023-03-30T16:14:22Z
1260,IPG,24/7 Wall St.,Lee Jackson,"Thursday’s Top Analyst Upgrades and Downgrades: Abbott Labs, Carnival, Delta Air Lines, First Republic Bank, Lululemon, Macy’s, Marathon Petroleum, Micron Technology and More",https://247wallst.com/investing/2023/03/30/thursday-upgrades-downgrades-abbott-laboratories-carnival-delta-air-lines-first-republic-bank-lululemon-athletica-macys-marathon-petroleum-medtronic-micron-technology-viking-therapeutics/,2023-03-30T12:55:54Z
1261,IPG,Marketscreener.com,MarketScreener,IPG Publishes Eighth Annual ESG Report,https://www.marketscreener.com/quote/stock/THE-INTERPUBLIC-GROUP-OF-13096/news/IPG-Publishes-Eighth-Annual-ESG-Report-43243826/?utm_medium=RSS&utm_content=20230314,2023-03-14T18:46:01Z
1262,INTU,Motley Fool,newsfeedback@fool.com (Courtney Carlsen),3 Stocks to Add to Your Portfolio in a Market Pullback,https://www.fool.com/investing/2023/03/17/stocks-to-add-to-portfolio-in-market-pullback/,2023-03-17T10:16:00Z
1263,INTU,24/7 Wall St.,Lee Jackson,"Thursday’s Top Analyst Upgrades and Downgrades: Charles Schwab, Comerica, KeyCorp, Meta Platforms, Microsoft, Netflix and More",https://247wallst.com/investing/2023/03/16/thursdays-top-analyst-upgrades-and-downgrades-azul-charles-schwab-comerica-keycorp-meta-platforms-microsoft-netflix-truist-financial/,2023-03-16T12:47:54Z
1264,INTU,24/7 Wall St.,Lee Jackson,"Tuesday’s Top Analyst Upgrades and Downgrades: Amgen, Baidu, Coinbase, Eli Lilly, JPMorgan, Merck, Moderna, Newmont and More",https://247wallst.com/investing/2023/03/14/tuesday-upgrades-downgrades-ally-financial-amgen-baidu-bilibili-coinbase-eli-lilly-ge-healthcare-jpmorgan-merck-moderna-newmont-palo-alto-networks-truist-financial-viking-therapeutics/,2023-03-14T12:47:39Z
1265,INTU,Yahoo Entertainment,News Direct,"Asure Software (NASDAQ: ASUR) Surpasses Expectations with Record-Breaking Q4 and FY 22 Financial Results, Raises Guidance for 2023",https://finance.yahoo.com/news/asure-software-nasdaq-asur-surpasses-164500703.html,2023-03-02T16:45:00Z
1266,INTU,24/7 Wall St.,Lee Jackson,"Tuesday’s Top Analyst Upgrades and Downgrades: Alphabet, Caterpillar, Corning, Dish Network, KeyCorp, Nvidia, Pinterest, Roku, Tesla, Wynn Resorts and More",https://247wallst.com/investing/2023/03/28/tuesdays-top-analyst-upgrades-and-downgrades-alphabet-caterpillar-corning-digital-realty-trust-dish-network-keycorp-nvidia-pinterest-roku-tesla-wynn-resorts/,2023-03-28T12:46:38Z
1267,ISRG,Motley Fool,newsfeedback@fool.com (Adria Cimino),2 Healthcare Stocks That Could Help Make You a Fortune,https://www.fool.com/investing/2023/03/08/2-healthcare-stocks-that-could-help-make-you-a-for/,2023-03-08T19:00:00Z
1268,ISRG,Motley Fool,newsfeedback@fool.com (Bradley Guichard),3 Top Growth Stocks I'd Buy Right Now Without Any Hesitation,https://www.fool.com/investing/2023/03/02/3-top-growth-stocks-id-buy-right-now-without-any-h/,2023-03-02T11:45:00Z
1269,ISRG,Motley Fool,newsfeedback@fool.com (Adria Cimino),Should You Really Buy Stocks Right Now? Here's What Warren Buffett Says.,https://www.fool.com/investing/2023/03/12/should-you-buy-stocks-heres-what-buffett-says/,2023-03-12T09:30:00Z
1270,ISRG,Motley Fool,newsfeedback@fool.com (Rachel Warren),"Have $1,500? 2 Explosive Stocks to Add to Your Buy Basket",https://www.fool.com/investing/2023/03/30/have-1500-2-stocks-to-add-to-your-buy-basket/,2023-03-30T14:15:00Z
1271,ISRG,Motley Fool,newsfeedback@fool.com (Sean Williams),3 Genius Stocks to Buy if the Fed Induces a Recession,https://www.fool.com/investing/2023/03/09/3-genius-stocks-to-buy-if-fed-induces-a-recession/,2023-03-09T10:21:00Z
1272,IVZ,Forbes,"Paul Katzeff, Contributor, 
 Paul Katzeff, Contributor
 https://www.forbes.com/sites/paulkatzeff/",12 Best ETFS To Buy For 2023,https://www.forbes.com/sites/investor-hub/article/12-best-etfs-to-buy-for-2023/,2023-03-17T01:05:04Z
1273,IVZ,24/7 Wall St.,Lee Jackson,"Thursday’s Top Analyst Upgrades and Downgrades: Abbott Labs, Carnival, Delta Air Lines, First Republic Bank, Lululemon, Macy’s, Marathon Petroleum, Micron Technology and More",https://247wallst.com/investing/2023/03/30/thursday-upgrades-downgrades-abbott-laboratories-carnival-delta-air-lines-first-republic-bank-lululemon-athletica-macys-marathon-petroleum-medtronic-micron-technology-viking-therapeutics/,2023-03-30T12:55:54Z
1274,IVZ,Marketscreener.com,MarketScreener,"Invesco Ltd. Announces February 28, 2023 Assets Under Management",https://www.marketscreener.com/quote/stock/INVESCO-LTD-11728/news/Invesco-Ltd-Announces-February-28-2023-Assets-Under-Management-43206654/?utm_medium=RSS&utm_content=20230309,2023-03-09T21:16:05Z
1275,IVZ,PRNewswire,,"Invesco Mortgage Capital Inc. Announces Quarterly Common Dividend and Provides Update on Estimated Results of Operations, Portfolio, Liquidity and Book Value",https://www.prnewswire.com/news-releases/invesco-mortgage-capital-inc-announces-quarterly-common-dividend-and-provides-update-on-estimated-results-of-operations-portfolio-liquidity-and-book-value-301782479.html,2023-03-27T20:15:00Z
1276,IVZ,MarketWatch,MarketWatch Automation,"Company Close Updates: INVESCO Ltd. stock rises Friday, outperforms market",https://www.marketwatch.com/data-news/invesco-ltd-stock-rises-friday-outperforms-market-7c19a0f-de7fb0dec624,2023-03-31T21:06:23Z
1277,INVH,Motley Fool,newsfeedback@fool.com (Liz Brumer-Smith),Here's Why Invitation Homes Can Be a Long-Term Winner,https://www.fool.com/real-estate-basics/2023/03/20/heres-why-invitation-homes-can-be-a-long-term-winn/,2023-03-20T13:03:00Z
1278,INVH,MarketWatch,Philip van Doorn,Deep Dive: 20 income-building stocks that the numbers say could become elite Dividend Aristocrats,https://www.marketwatch.com/story/20-income-building-stocks-that-the-numbers-say-could-become-elite-dividend-aristocrats-a16ecad6,2023-03-06T16:10:00Z
1279,INVH,Motley Fool,newsfeedback@fool.com (Liz Brumer-Smith),Want to Invest in the Real Estate Market With Less Stress? Try This REIT.,https://www.fool.com/real-estate/2023/03/02/want-to-invest-in-the-real-estate-market-with-less/,2023-03-02T11:59:00Z
1280,INVH,Motley Fool,newsfeedback@fool.com (Liz Brumer-Smith),These 3 High-Yield Dividend Stocks Just Raised Their Dividends by 10% or More,https://www.fool.com/investing/2023/03/14/high-yield-dividend-stocks-raised-10-percent/,2023-03-14T09:44:00Z
1281,INVH,Motley Fool,newsfeedback@fool.com (Matthew DiLallo),Top REIT Mutual Funds,https://www.fool.com/investing/stock-market/market-sectors/real-estate-investing/reit/reit-mutual-funds/,2023-03-10T16:44:35Z
1282,IQV,Motley Fool,newsfeedback@fool.com (Jim Halley),"2 Clinical Research Stocks That Could Grow by More Than 10% This Year, and 1 to Watch",https://www.fool.com/investing/2023/03/25/2-clinical-research-stocks-that-could-grow-by-more/,2023-03-25T11:20:00Z
1283,IQV,MarketWatch,MarketWatch Automation,Company Close Updates: Laboratory Corp. of America Holdings stock underperforms Monday when compared to competitors,https://www.marketwatch.com/data-news/laboratory-corp-of-america-holdings-stock-underperforms-monday-when-compared-to-competitors-565b963f-6db8bc10ce08,2023-03-13T21:07:05Z
1284,IQV,MarketWatch,MarketWatch Automation,"Company Close Updates: Quest Diagnostics Inc. stock rises Friday, outperforms market",https://www.marketwatch.com/data-news/quest-diagnostics-inc-stock-rises-friday-outperforms-market-127c585c-0c3cedde902b,2023-03-31T20:50:40Z
1285,IRM,Motley Fool,newsfeedback@fool.com (Liz Brumer-Smith),This Dividend Stock Has Market-Beating Potential,https://www.fool.com/real-estate/2023/03/20/this-dividend-stock-has-market-beating-potential/,2023-03-20T10:48:00Z
1286,IRM,Motley Fool,"newsfeedback@fool.com (Matthew Frankel, CFP® and Tyler Crowe)",1 Unique REIT for Wealth Creation in a Turbulent Market,https://www.fool.com/investing/2023/03/28/1-unique-reit-for-wealth-creation-in-a-turbulent-m/,2023-03-28T11:33:00Z
1287,IRM,Yahoo Entertainment,Insider Monkey Transcripts,Sociedad Química y Minera de Chile S.A. (NYSE:SQM) Q4 2022 Earnings Call Transcript,https://finance.yahoo.com/news/sociedad-qu-mica-y-minera-015828229.html,2023-03-07T01:58:28Z
1288,IRM,Biztoc.com,investors.com,Iron Mountain Stock A Steady Eddie; Job 1: Data Protection,https://biztoc.com/x/aede9460d9e713a3,2023-03-16T19:18:15Z
1289,IRM,Marketscreener.com,MarketScreener,Code42 and SentinelOne Partner to Uncover Risk to Data and Accelerate Response to Insider Threats,https://www.marketscreener.com/quote/stock/SENTINELONE-INC-124221575/news/Code42-and-SentinelOne-Partner-to-Uncover-Risk-to-Data-and-Accelerate-Response-to-Insider-Threats-43181296/?utm_medium=RSS&utm_content=20230307,2023-03-07T14:04:02Z
1290,JBHT,Biztoc.com,investors.com,"J.B. Hunt Stock Revs Higher, Gains Strength",https://biztoc.com/x/f72f10fba47e82e3,2023-03-09T22:32:22Z
1291,JBHT,Marketscreener.com,MarketScreener,J.B. Hunt's People-Focused Culture Earns National Recognitions From Forbes and Newsweek for Workplace Excellence,https://www.marketscreener.com/quote/stock/J-B-HUNT-TRANSPORT-SERVI-9769/news/J-B-Hunt-s-People-Focused-Culture-Earns-National-Recognitions-From-Forbes-and-Newsweek-for-Workplac-43192697/?utm_medium=RSS&utm_content=20230308,2023-03-08T15:05:02Z
1292,JBHT,Investopedia,Staff Author,"Markets Gain on Bank Rebound, Inflation Report",https://www.investopedia.com/markets-gain-on-bank-rebound-inflation-report-7255405,2023-03-14T21:39:36Z
1293,JKHY,Marketscreener.com,MarketScreener,Jack Henry Recognized for Lending Innovation in FinTech Breakthrough Awards Program,https://www.marketscreener.com/quote/stock/JACK-HENRY-ASSOCIATES-9781/news/Jack-Henry-Recognized-for-Lending-Innovation-in-FinTech-Breakthrough-Awards-Program-43321064/?utm_medium=RSS&utm_content=20230323,2023-03-23T12:31:07Z
1294,JKHY,Marketscreener.com,MarketScreener,SMA Technologies and Jack Henry Collaborate to Improve Operational Efficiencies for Banks & Credit Unions,https://www.marketscreener.com/quote/stock/JACK-HENRY-ASSOCIATES-9781/news/SMA-Technologies-and-Jack-Henry-Collaborate-to-Improve-Operational-Efficiencies-for-Banks-Credit-U-43240915/?utm_medium=RSS&utm_content=20230314,2023-03-14T13:01:13Z
1295,JKHY,Thefly.com,,"Street Wrap: Today's Top 15 Upgrades, Downgrades, Initiations",https://thefly.com/permalinks/entry.php/id3680430/SCHW;JKHY;TFC;BKR;QTWO;VCSA;AMPL;SWAV;DBTX;PRCH;HOG;VTS;COOK;WAL-Street-Wrap-Todays-Top--Upgrades-Downgrades-Initiations,2023-03-15T13:35:02Z
1296,JKHY,Thefly.com,,"Street Wrap: Today's Top 15 Upgrades, Downgrades, Initiations",https://thefly.com/permalinks/entry.php/id3680430/WAL;SCHW;JKHY;TFC;BKR;QTWO;VCSA;AMPL;SWAV;DBTX;PRCH;HOG;VTS;COOK-Street-Wrap-Todays-Top--Upgrades-Downgrades-Initiations,2023-03-15T13:35:02Z
