,Company,Source,Author,Title,URL,Publish_Date
0,MMM,Motley Fool,"newsfeedback@fool.com (Parkev Tatevosian, CFA)",Best Dividend Stock to Buy: 3M vs. Devon Energy,https://www.fool.com/investing/2023/03/20/best-dividend-stock-to-buy-3m-vs-devon-energy/,2023-03-20T14:09:26Z
1,MMM,Motley Fool,newsfeedback@fool.com (Jason Hall and Tyler Crowe),2 Reasons Buying 3M Could Be a Dividend Stock Mistake,https://www.fool.com/investing/2023/03/21/2-reasons-buying-3m-could-be-a-dividend-stock-mist/,2023-03-21T15:06:43Z
2,MMM,Forbes,"Trefis Team, Contributor, 
 Trefis Team, Contributor
 https://www.forbes.com/sites/greatspeculations/people/trefis/",What Led To A 40% Fall In 3M Stock Since 2019?,https://www.forbes.com/sites/greatspeculations/2023/03/15/what-led-to-a-40-fall-in-3m-stock-since-2019/,2023-03-15T12:00:57Z
3,MMM,Motley Fool,newsfeedback@fool.com (Justin Pope),"If You Invested $100 in 3M Company In 2000, This Is How Much You Would Have Today",https://www.fool.com/investing/2023/03/19/if-you-invested-100-in-3m-company-in-2000-this-is/,2023-03-19T09:01:00Z
4,MMM,Motley Fool,newsfeedback@fool.com (Reuben Gregg Brewer),Is 3M Stock a Buy?,https://www.fool.com/investing/2023/03/23/is-3m-stock-a-buy/,2023-03-23T12:30:00Z
5,AOS,Yahoo Entertainment,Soumya Eswaran,Should You Add A.O. Smith Corporation (AOS) to Your Portfolio as the Orders Rebound?,https://finance.yahoo.com/news/add-o-smith-corporation-aos-063437986.html,2023-03-24T06:34:37Z
6,AOS,Motley Fool,newsfeedback@fool.com (Kody Kester),"If You Like Dividends, You Should Love These 3 Stocks",https://www.fool.com/investing/2023/03/20/if-you-like-dividends-you-should-love-these-3-stoc/,2023-03-20T13:10:00Z
7,AOS,Yahoo Entertainment,"Acumen Pharmaceuticals, Inc.","Acumen Pharmaceuticals Reports Financial Results for Full Year Ended December 31, 2022 and Business Highlights",https://finance.yahoo.com/news/acumen-pharmaceuticals-reports-financial-results-110000758.html,2023-03-27T11:00:00Z
8,AOS,Marketscreener.com,MarketScreener,Canon : Aviso aos Acionistas,https://www.marketscreener.com/quote/stock/CANON-INC-6492463/news/Canon-Aviso-aos-Acionistas-43172913/?utm_medium=RSS&utm_content=20230306,2023-03-06T18:45:03Z
9,AOS,Marketscreener.com,MarketScreener,Veradigm : Aviso aos Acionistas,https://www.marketscreener.com/quote/stock/VERADIGM-INC-9987/news/Veradigm-Aviso-aos-Acionistas-43153241/?utm_medium=RSS&utm_content=20230303,2023-03-03T20:50:22Z
10,ABT,Forbes,"Trefis Team, Contributor, 
 Trefis Team, Contributor
 https://www.forbes.com/sites/greatspeculations/people/trefis/",What Is Driving Growth For Abbott Stock?,https://www.forbes.com/sites/greatspeculations/2023/03/20/what-is-driving-growth-for-abbott-stock/,2023-03-20T12:00:28Z
11,ABT,Biztoc.com,investors.com,Dexcom Pummeled On A New FDA Clearance For Key Rival Abbott Laboratories,https://biztoc.com/x/be608cffc5b3c6a5,2023-03-06T17:50:06Z
12,ABT,Yahoo Entertainment,Soumya Eswaran,Is Abbott Laboratories (ABT) a Safe Stock to Invest in?,https://finance.yahoo.com/news/abbott-laboratories-abt-safe-stock-121024242.html,2023-03-24T12:10:24Z
13,ABT,Motley Fool,newsfeedback@fool.com (Kody Kester),2 Top Dividend Stocks You Can Buy and Hold Forever,https://www.fool.com/investing/2023/03/09/2-top-dividend-stocks-you-can-buy-and-hold-forever/,2023-03-09T10:17:00Z
14,ABT,Motley Fool,newsfeedback@fool.com (Alex Carchidi),Build Your Wealth by Buying and Holding These 2 Dividend Stocks for at Least 20 Years,https://www.fool.com/investing/2023/03/02/build-your-wealth-by-buying-these-2-dividend/,2023-03-02T15:15:00Z
15,ABBV,Motley Fool,newsfeedback@fool.com (Jim Halley),3 Things About AbbVie That Smart Investors Know,https://www.fool.com/investing/2023/03/23/3-things-about-abbvie-that-smart-investors-know/,2023-03-23T13:15:00Z
16,ABBV,Motley Fool,newsfeedback@fool.com (Adria Cimino),Is It Too Late to Buy AbbVie Stock?,https://www.fool.com/investing/2023/03/09/is-it-too-late-to-buy-abbvie-stock/,2023-03-09T10:30:00Z
17,ABBV,Motley Fool,"newsfeedback@fool.com (Mark Roussin, CPA)",This Is the Best Dividend ETF You Can Buy,https://www.fool.com/investing/2023/03/28/this-is-the-best-dividend-etf-you-can-buy/,2023-03-28T12:13:00Z
18,ABBV,Forbes,"Trefis Team, Contributor, 
 Trefis Team, Contributor
 https://www.forbes.com/sites/greatspeculations/people/trefis/",Should You Buy The Botox Maker Over Johnson & Johnson Stock?,https://www.forbes.com/sites/greatspeculations/2023/03/21/should-you-buy-the-botox-maker-over-johnson--johnson-stock/,2023-03-21T12:00:02Z
19,ABBV,Motley Fool,newsfeedback@fool.com (David Jagielski),2 High-Yielding Dividend Investments to Buy for the Long Haul,https://www.fool.com/investing/2023/03/30/2-high-yielding-dividend-investments-for-long-haul/,2023-03-30T11:45:00Z
20,ACN,Google News,,"ACN Stock: Accenture Earnings, Revenue Top Estimates, Tech Services Stock Rises | Investor's Business Daily - Investor's Business Daily",https://consent.google.com/ml?continue=https://news.google.com/rss/articles/CBMiTmh0dHBzOi8vd3d3LmludmVzdG9ycy5jb20vbmV3cy90ZWNobm9sb2d5L2Fjbi1zdG9jay1hY2NlbnR1cmUtZWFybmluZ3MtcTIyMDIyL9IBAA?oc%3D5&gl=FR&hl=en-US&cm=2&pc=n&src=1,2023-03-23T12:19:35Z
21,ACN,Motley Fool,newsfeedback@fool.com (Leo Sun),Is Accenture Stock a Buy Now?,https://www.fool.com/investing/2023/03/27/is-accenture-stock-a-buy-now/,2023-03-27T10:53:00Z
22,ACN,Yahoo Entertainment,Soumya Eswaran,Should You Consider Adding Accenture plc (ACN) to Your Watchlist?,https://finance.yahoo.com/news/consider-adding-accenture-plc-acn-121655000.html,2023-03-06T12:16:55Z
23,ACN,Yahoo Entertainment,NewMediaWire,Kingsoft Announces 2022 Annual and Fourth Quarter Results,https://finance.yahoo.com/news/kingsoft-announces-2022-annual-fourth-155113899.html,2023-03-25T15:51:13Z
24,ACN,Investor's Business Daily,Investor's Business Daily,"Dow Jones Futures Rise After Fed Sell-Off; Apple, 5 Titans Mask Market Weakness",https://www.investors.com/market-trend/stock-market-today/dow-jones-futures-fed-sell-off-apple-5-titans-mask-market-weakness/,2023-03-23T10:09:37Z
25,ATVI,Motley Fool,newsfeedback@fool.com (Jose Najarro and Ryan Henderson),"Will Microsoft's Acquisition of Activision Happen, and What Could It Mean for Investors?",https://www.fool.com/investing/2023/03/03/will-microsofts-acquisition-of-activision-happen-a/,2023-03-03T13:15:37Z
26,ATVI,Forbes,"Trefis Team, Contributor, 
 Trefis Team, Contributor
 https://www.forbes.com/sites/greatspeculations/people/trefis/","Up 10% In A Month, Does Activision Blizzard Stock Have More Upside?",https://www.forbes.com/sites/greatspeculations/2023/03/07/up-10-in-a-month-does-activision-blizzard-stock-have-more-upside/,2023-03-07T13:00:00Z
27,ATVI,Motley Fool,newsfeedback@fool.com (Travis Hoium),Why Take-Two Interactive Software's Shares Rose on Tuesday,https://www.fool.com/investing/2023/03/07/why-take-two-interactive-softwares-shares-rose-on/,2023-03-07T17:26:41Z
28,ATVI,Motley Fool,newsfeedback@fool.com (Brett Schafer),Is Activision Blizzard Stock a Buy Even Without the Microsoft Deal?,https://www.fool.com/investing/2023/03/29/is-activision-stock-a-buy-even-without-deal/,2023-03-29T12:45:00Z
29,ATVI,Yahoo Entertainment,Soumya Eswaran,Here’s What Dragged Activision Blizzard (ATVI) Stock,https://finance.yahoo.com/news/dragged-activision-blizzard-atvi-stock-103724198.html,2023-03-20T10:37:24Z
30,ADM,Yahoo Entertainment,Global Market Insights Inc.,"Fish Oil Alternatives Market to exceed $3.5 Bn by 2032, Says Global Market Insights Inc.",https://finance.yahoo.com/news/fish-oil-alternatives-market-exceed-111000661.html,2023-03-23T11:10:00Z
31,ADM,The Guardian,Phillip Inman,‘Global greedflation’: big firms ‘drive shopping bills to record highs’,https://www.theguardian.com/business/2023/mar/12/global-greedflation-big-firms-drive-shopping-bills-to-record-highs,2023-03-12T16:00:03Z
32,ADM,Marketscreener.com,MarketScreener,ADM Names Hydrite® as a 2022 Supplier Award Winner,https://www.marketscreener.com/quote/stock/ARCHER-DANIELS-MIDLAND-CO-11533/news/ADM-Names-Hydrite-as-a-2022-Supplier-Award-Winner-43139678/?utm_medium=RSS&utm_content=20230302,2023-03-02T15:11:03Z
33,ADM,Biztoc.com,entrepreneur.com,1 Agriculture Stock to Buy This Month and 1 to Sell,https://biztoc.com/x/00fc66a146932b63,2023-03-14T13:36:07Z
34,ADM,Yahoo Entertainment,Vardah Gill,14 Best Consumer Staples Dividend Stocks To Buy Now,https://finance.yahoo.com/news/14-best-consumer-staples-dividend-230010540.html,2023-03-06T23:00:10Z
35,ADBE,MarketWatch,Wallace Witkowski,"Earnings Results: Adobe stock rallies 5% as results, outlook top Street views",https://www.marketwatch.com/story/adobe-stock-rallies-5-as-results-outlook-top-street-views-d6246e5a,2023-03-15T19:27:00Z
36,ADBE,Motley Fool,"newsfeedback@fool.com (Parkev Tatevosian, CFA)",Is Adobe Stock a Buy After Q1 Earnings?,https://www.fool.com/investing/2023/03/20/is-adobe-stock-a-buy-after-q1-earnings/,2023-03-20T13:15:23Z
37,ADBE,Forbes,"Trefis Team, Contributor, 
 Trefis Team, Contributor
 https://www.forbes.com/sites/greatspeculations/people/trefis/","Adobe Stock Topped The Consensus In Q1, What’s Next?",https://www.forbes.com/sites/greatspeculations/2023/03/17/adobe-stock-topped-the-consensus-in-q1-whats-next/,2023-03-17T12:00:00Z
38,ADBE,Motley Fool,newsfeedback@fool.com (Jose Najarro),Adobe's Strong Earnings Show the Power of Its Creative Solutions,https://www.fool.com/investing/2023/03/16/adobes-stock-strong-earnings-show-the-power-of-its/,2023-03-16T14:06:28Z
39,ADBE,MarketWatch,Wallace Witkowski,Key Words: Bill Gates says AI is only the second ‘revolutionary’ tech advancement in his lifetime,https://www.marketwatch.com/story/bill-gates-says-ai-is-only-the-second-revolutionary-tech-advancement-in-his-lifetime-72c7fddf,2023-03-21T19:43:00Z
40,ADP,Business Insider,prosen@insider.com (Phil Rosen),The Fed wants higher unemployment because it would bring down inflation,https://www.businessinsider.com/jerome-powell-fed-jobs-unemployment-nonfarm-payrolls-inflation-markets-economy-2023-3,2023-03-10T11:03:00Z
41,ADP,Nature.com,"Warintra Pitsawong, Ricardo A. P. Pádua, Timothy Grant, Marc Hoemberger, Renee Otten, Niels Bradshaw, Nikolaus Grigorieff, Dorothee Kern",From primordial clocks to circadian oscillators,https://www.nature.com/articles/s41586-023-05836-9,2023-03-22T00:00:00Z
42,ADP,Biztoc.com,seekingalpha.com,"S&P, Nasdaq, Dow futures tick up as market braces for the return of Powell",https://biztoc.com/x/5b5ded5d41ab99b0,2023-03-08T12:04:11Z
43,ADP,MarketWatch,Philip van Doorn,Deep Dive: 20 income-building stocks that the numbers say could become elite Dividend Aristocrats,https://www.marketwatch.com/story/20-income-building-stocks-that-the-numbers-say-could-become-elite-dividend-aristocrats-a16ecad6,2023-03-06T16:10:00Z
44,ADP,Yahoo Entertainment,Aéroports de Paris,Aéroports de Paris - Groupe ADP and GMR Enterprises enter into agreement to form an airport holding company listed on Indian Stock Exchanges by the first half of 2024,https://finance.yahoo.com/news/roports-paris-groupe-adp-gmr-170100894.html,2023-03-19T17:01:00Z
45,AAP,The Indian Express,PTI,"Both Congress, BJP want all other political parties to cease to exist: AAP",https://indianexpress.com/article/cities/delhi/both-congress-bjp-want-all-other-political-parties-to-cease-to-exist-aap-8480824/,2023-03-05T14:58:24Z
46,AAP,Yahoo Entertainment,CalciMedica,CalciMedica Announces Closing of Merger with Graybug Vision and Concurrent Private Placement,https://finance.yahoo.com/news/calcimedica-announces-closing-merger-graybug-202500944.html,2023-03-20T20:25:00Z
47,AAP,TheStreet,Stephen Guilfoyle,Nvidia's Charts Tell the Tale of How to Trade the Stock,https://realmoney.thestreet.com/investing/nvidia-s-charts-tell-the-tale-of-how-to-trade-the-stock-16118261,2023-03-14T14:15:00Z
48,AAP,Forbes,"Q.ai - Powering a Personal Wealth Movement, Contributor, 
 Q.ai - Powering a Personal Wealth Movement, Contributor
 https://www.forbes.com/sites/qai/",Jobs Report Offers Mixed Results And Fed Says Interest Could Go Higher Than Expected - Forbes AI Newsletter March 11th,https://www.forbes.com/sites/qai/2023/03/13/jobs-report-offers-mixed-results-and-fed-says-interest-could-go-higher-than-expectedforbes-ai-newsletter-march-11th/,2023-03-13T15:13:06Z
49,AAP,Moneycontrol,PTI,Opposition leaders hold protest in Parliament House complex over Adani issue,https://www.moneycontrol.com/news/politics/opposition-leaders-hold-protest-in-parliament-house-complex-over-adani-issue-10284861.html,2023-03-21T07:09:45Z
50,AES,TheStreet,Bob Lang,Bearish Bets: 3 Stocks You Should Consider Shorting This Week,https://realmoney.thestreet.com/investing/stocks/bearish-bets-3-stocks-you-should-consider-shorting-this-week-16117421,2023-03-05T15:30:00Z
51,AES,Yahoo Entertainment,Simply Wall St,Investors in AES (NYSE:AES) have made a stellar return of 144% over the past five years,https://finance.yahoo.com/news/investors-aes-nyse-aes-made-124535910.html,2023-03-21T12:45:35Z
52,AES,R-bloggers.com,R | TypeThePipe,Financial Markets & Value Invest in R (I) – Analyzing Market Cap data with fmpcloudr and ggplot,https://www.r-bloggers.com/2023/03/financial-markets-value-invest-in-r-i-analyzing-market-cap-data-with-fmpcloudr-and-ggplot/,2023-03-10T00:00:00Z
53,AES,Motley Fool,"newsfeedback@fool.com (Daniel Foelber, Scott Levine, and Lee Samaha)",Like Passive Income? Then You'll Love These 3 Dividend Stocks.,https://www.fool.com/investing/2023/03/16/like-passive-income-then-love-dividend-stock-yield/,2023-03-16T09:30:00Z
54,AES,Electronics-lab.com,Tope Oluyemi,SparkFun LoRaSerial Kit Boosts The Range of Your Transmission,https://www.electronics-lab.com/sparkfun-loraserial-kit-boosts-the-range-of-your-transmission/,2023-03-30T13:07:30Z
55,AFL,NPR,Andrea Hsu,Unions are having a moment. So why isn't union membership booming?,https://www.npr.org/2023/03/28/1165294695/labor-union-starbucks-amazon-howard-schultz-workers,2023-03-28T09:00:24Z
56,AFL,ABC News (AU),Dean Bilton,AFL Round-Up: Pre-season promises lead to round one delight in gripping AFL opener,https://www.abc.net.au/news/2023-03-20/afl-round-up-one-collingwood-jason-horne-francis-bulldogs/102116930,2023-03-19T18:04:20Z
57,AFL,The Guardian,"Jonny Weeks, Larry Ryan and Grace Holliday. Picture research: Tracey Tomlin",‘We could feel the gravity of it. It was electrifying’: 50 photographs that reshaped sport,https://www.theguardian.com/sport/2023/mar/11/we-could-feel-the-gravity-of-it-it-was-electrifying-50-photographs-that-reshaped-sport,2023-03-11T08:00:17Z
58,AFL,ABC News (AU),Dean Bilton,AFL Round-Up: Gawn gives Dees new headache as Daicos ascends to new heights,https://www.abc.net.au/news/2023-03-27/afl-round-up-two-max-gawn-nick-daicos-north-melbourne-saints/102147288,2023-03-26T17:52:23Z
59,AFL,Ozbargain.com.au,divenzioau,Gold Label Whole Coffee Beans BOGOF: 2kg for $57 + Free Shipping @ DiVenzio Coffee,https://www.ozbargain.com.au/node/764196,2023-03-22T09:32:00Z
60,A,Engadget,Igor Bonifacic,Biden administration bars CHIPS Act funding recipients from expanding in China,https://www.engadget.com/biden-administration-bars-chips-act-funding-recipients-from-expanding-in-china-172637590.html,2023-03-04T17:26:37Z
61,A,Engadget,Jon Fingas,Sonic the Hedgehog co-creator Yuji Naka pleads guilty to insider trading,https://www.engadget.com/sonic-the-hedgehog-co-creator-yuji-naka-pleads-guilty-to-insider-trading-175609657.html,2023-03-03T17:56:09Z
62,A,Engadget,Steve Dent,The Nintendo Switch OLED is $30 off right now,https://www.engadget.com/the-nintendo-switch-oled-is-30-off-right-now-131533906.html,2023-03-27T13:15:33Z
63,A,Engadget,Billy Steele,Master & Dynamic gives its MH40 headphones new drivers and longer battery life,https://www.engadget.com/master-and-dynamic-gives-its-mh40-headphones-new-drivers-and-longer-battery-life-120001289.html,2023-03-14T12:00:01Z
64,A,Slashdot.org,msmash,"A Video Game Company Made a Bot the CEO, and Its Stock Climbed",https://slashdot.org/story/23/03/16/1855254/a-video-game-company-made-a-bot-the-ceo-and-its-stock-climbed,2023-03-16T22:05:00Z
65,APD,Motley Fool,newsfeedback@fool.com (Nicholas Rossolillo),"Down 10% From Highs, Is This Top Semiconductor Supplier a Buy Now?",https://www.fool.com/investing/2023/03/02/down-10-from-highs-is-this-top-semiconductor-suppl/,2023-03-02T10:36:00Z
66,APD,Motley Fool,"newsfeedback@fool.com (Daniel Foelber, Scott Levine, and Lee Samaha)",Like Passive Income? Then You'll Love These 3 Dividend Stocks.,https://www.fool.com/investing/2023/03/16/like-passive-income-then-love-dividend-stock-yield/,2023-03-16T09:30:00Z
67,APD,Yahoo Entertainment,Zacks Equity Research,Air Products and Chemicals (APD) Gains But Lags Market: What You Should Know,https://finance.yahoo.com/news/air-products-chemicals-apd-gains-221510982.html,2023-03-24T22:15:10Z
68,APD,Yahoo Entertainment,Simply Wall St,"Is Air Products and Chemicals, Inc. (NYSE:APD) Potentially Undervalued?",https://finance.yahoo.com/news/air-products-chemicals-inc-nyse-120024739.html,2023-03-19T12:00:24Z
69,APD,CNBC,Jeff Marks,"Top 10 things the Club is watching in the stock market Tuesday: Fed's Powell, Meta, obesity",https://www.cnbc.com/2023/03/07/top-10-things-to-watch-in-stock-market-tuesday-feds-powell-meta-obesity.html,2023-03-07T13:09:17Z
70,AKAM,Forbes,"Trefis Team, Contributor, 
 Trefis Team, Contributor
 https://www.forbes.com/sites/greatspeculations/people/trefis/",Will Akamai’s Cloud Computing Push Pay Off?,https://www.forbes.com/sites/greatspeculations/2023/03/15/will-akamais-cloud-computing-push-pay-off/,2023-03-15T11:00:20Z
71,AKAM,Thefly.com,,"Fly Insider : Uniti Group, AutoNation among week's notable insider trades",https://thefly.com/permalinks/entry.php/id3679166/UNIT;RBOT;MYOV;OXY;BMBL;ABNB;AN;AKAM-Fly-Insider--Uniti-Group-AutoNation-among-weeks-notable-insider-trades,2023-03-13T19:36:10Z
72,AKAM,Marketscreener.com,MarketScreener,Akamai Research Finds Up To 16 Percent of Organizations Exhibited Signs of a Breach in 2022,https://www.marketscreener.com/quote/stock/AKAMAI-TECHNOLOGIES-INC-8303/news/Akamai-Research-Finds-Up-To-16-Percent-of-Organizations-Exhibited-Signs-of-a-Breach-in-2022-43237827/?utm_medium=RSS&utm_content=20230314,2023-03-14T10:33:03Z
73,AKAM,Marketscreener.com,MarketScreener,Akamai Technologies Releases New Service and Tools to Stop Advanced Threats and Drive Zero Trust Adoption,https://www.marketscreener.com/quote/stock/AKAMAI-TECHNOLOGIES-INC-8303/news/Akamai-Technologies-Releases-New-Service-and-Tools-to-Stop-Advanced-Threats-and-Drive-Zero-Trust-Ado-43179265/?utm_medium=RSS&utm_content=20230307,2023-03-07T11:03:03Z
74,AKAM,Marketscreener.com,MarketScreener,Akamai Technologies To Acquire Cloud Storage Technology Company Ondat,https://www.marketscreener.com/quote/stock/AKAMAI-TECHNOLOGIES-INC-8303/news/Akamai-Technologies-To-Acquire-Cloud-Storage-Technology-Company-Ondat-43138325/?utm_medium=RSS&utm_content=20230302,2023-03-02T13:07:03Z
75,ALK,Forbes,"Trefis Team, Contributor, 
 Trefis Team, Contributor
 https://www.forbes.com/sites/greatspeculations/people/trefis/",What Led To A 24% Fall In Alaska Air Stock Since 2020?,https://www.forbes.com/sites/greatspeculations/2023/03/22/what-led-to-a-24-fall-in-alaska-air-stock-since-2020/,2023-03-22T12:00:57Z
76,ALK,Motley Fool,newsfeedback@fool.com (Micah Angel),Better Buy: Sun Country Airlines or Alaska Air Group Stock?,https://www.fool.com/investing/2023/03/16/better-buy-sun-country-airlines-or-alaska-air-grou/,2023-03-16T09:47:00Z
77,ALK,Yahoo Entertainment,ALK Abello,Grant of share-based long-term incentive instruments to members of the Board of Management and key employees,https://finance.yahoo.com/news/grant-share-based-long-term-153000922.html,2023-03-31T15:30:00Z
78,ALK,Forbes,"Trefis Team, Contributor, 
 Trefis Team, Contributor
 https://www.forbes.com/sites/greatspeculations/people/trefis/",This Aviation Company Appears To Be A Better Pick Over United Airlines Stock,https://www.forbes.com/sites/greatspeculations/2023/03/28/this-aviation-company-appears-to-be-a-better-pick-over-united-airlines-stock/,2023-03-28T10:00:47Z
79,ALK,Biztoc.com,forbes.com,What Led To A 24% Fall In Alaska Air Stock Since 2020?,https://biztoc.com/x/2f8b0517644318b4,2023-03-22T12:28:06Z
80,ALB,Motley Fool,newsfeedback@fool.com (David Moadel),"If You Invested $1,000 in Livent Stock a Year Ago, This Is How Much You Would Have Today",https://www.fool.com/investing/2023/03/19/if-you-invested-1000-in-livent-stock-a-year-ago-th/,2023-03-19T11:01:00Z
81,ALB,Yahoo Entertainment,PR Newswire,Albemarle Announces Proposal to Acquire Liontown,https://finance.yahoo.com/news/albemarle-announces-proposal-acquire-liontown-005100498.html,2023-03-28T00:51:00Z
82,ALB,Motley Fool,"newsfeedback@fool.com (Daniel Foelber, Anders Bylund, Keith Speights, Neha Chamaria, and Trevor Jennewine)",5 Top Stocks for March,https://www.fool.com/investing/2023/03/03/5-top-stocks-for-march/,2023-03-03T11:30:00Z
83,ALB,Yahoo Entertainment,Simply Wall St,Albemarle Corporation (NYSE:ALB) Stock Has Shown Weakness Lately But Financials Look Strong: Should Prospective Shareholders Make The Leap?,https://finance.yahoo.com/news/albemarle-corporation-nyse-alb-stock-111941786.html,2023-03-03T11:19:41Z
84,ALB,ValueWalk,Aman Jain,EV Stock Picks For Novices That Pay Electrifying Dividends,https://www.valuewalk.com/ev-stock-picks-for-novices-that-pay-electrifying-dividends/,2023-03-10T20:01:08Z
85,ARE,CNN,Anna Cooban,"Credit Suisse's gold bars, hats and bags are cropping up in online stores",https://www.cnn.com/2023/03/21/business/credit-suisse-merchandise-online/index.html,2023-03-21T13:33:43Z
86,ARE,CNN,Matt Egan,'Absolutely idiotic'. SVB insider says employees are angry with CEO,https://www.cnn.com/2023/03/13/business/svb-employees-angry-at-ceo/index.html,2023-03-13T19:45:48Z
87,ARE,Engadget,Steve Dent,The Nintendo Switch OLED is $30 off right now,https://www.engadget.com/the-nintendo-switch-oled-is-30-off-right-now-131533906.html,2023-03-27T13:15:33Z
88,ARE,CNN,Jeanne Sahadi,Beyond FDIC insurance: How protected is your money outside of banks?,https://www.cnn.com/2023/03/28/success/protections-insurance-financial-accounts-your-money/index.html,2023-03-28T14:06:07Z
89,ARE,BBC News,https://www.facebook.com/bbcnews,"Atmospheric river to bring more snow, rain and floods to California",https://www.bbc.co.uk/news/world-us-canada-64911139,2023-03-10T14:14:45Z
90,ALGN,Yahoo Entertainment,Soumya Eswaran,Does Align Technology (ALGN) Have a Long Runway for Growth?,https://finance.yahoo.com/news/does-align-technology-algn-long-112307162.html,2023-03-24T11:23:07Z
91,ALGN,24/7 Wall St.,Lee Jackson,"Tuesday’s Top Analyst Upgrades and Downgrades: Altria, Apple, GE, Pfizer, Silvergate, Tesla, Verizon and More",https://247wallst.com/investing/2023/03/07/tuesdays-top-analyst-upgrades-and-downgrades-altria-apple-dr-horton-equitrans-midstream-fortinet-general-electric-nextracker-palo-alto-networks-pfizer-silvergate-capital-tesla-verizon/,2023-03-07T13:46:07Z
92,ALGN,24/7 Wall St.,Lee Jackson,"Wednesday’s Top Analyst Upgrades and Downgrades: Alphabet, Foot Locker, Meta Platforms, New York Community Bancorp, Nvidia, Rio Tinto and More",https://247wallst.com/investing/2023/03/22/wednesdays-top-analyst-upgrades-and-downgrades-alphabet-danaher-emerson-electric-foot-locker-meta-platforms-new-york-community-bancorp-nvidia-prologis-rio-tinto-vornado-realty-trust/,2023-03-22T12:53:39Z
93,ALGN,MarketWatch,MarketWatch Automation,Company Close Updates: Dentsply Sirona Inc. stock outperforms market on strong trading day,https://www.marketwatch.com/data-news/dentsply-sirona-inc-stock-outperforms-market-on-strong-trading-day-b92684fa-242ea1de95ba,2023-03-13T21:38:33Z
94,ALGN,MarketWatch,MarketWatch Automation,"Company Close Updates: Dentsply Sirona Inc. stock falls Wednesday, underperforms market",https://www.marketwatch.com/data-news/dentsply-sirona-inc-stock-falls-wednesday-underperforms-market-504521cf-3f8b25402690,2023-03-15T21:40:18Z
95,ALLE,MarketWatch,Philip van Doorn,Deep Dive: 20 income-building stocks that the numbers say could become elite Dividend Aristocrats,https://www.marketwatch.com/story/20-income-building-stocks-that-the-numbers-say-could-become-elite-dividend-aristocrats-a16ecad6,2023-03-06T16:10:00Z
96,ALLE,Egenix.com,,eGenix.com: Python Meeting Düsseldorf - 2023-03-22,https://www.egenix.com/company/news/Python-Meeting-Duesseldorf-2023-03-22,2023-03-16T09:00:00Z
97,ALLE,Cineblog.it,Pietro Ferraro,Stasera in tv: “The Gentlemen” con Matthew McConaughey su Rai 2,https://www.cineblog.it/post/the-gentlemen-in-tv-rai-2-oggi,2023-03-16T11:48:18Z
98,ALLE,Marketscreener.com,MarketScreener,Netcompany A/S : AGM 2023 Minutes,https://www.marketscreener.com/quote/stock/NETCOMPANY-GROUP-A-S-44172535/news/Netcompany-A-S-AGM-2023-Minutes-43191124/?utm_medium=RSS&utm_content=20230308,2023-03-08T12:37:12Z
99,ALLE,Marketscreener.com,MarketScreener,Allegion to Attend 2023 Bank of America Global Industrials Conference,https://www.marketscreener.com/quote/stock/ALLEGION-PLC-14946780/news/Allegion-to-Attend-2023-Bank-of-America-Global-Industrials-Conference-43184880/?utm_medium=RSS&utm_content=20230307,2023-03-07T22:01:02Z
100,LNT,24/7 Wall St.,Paul Ausick,"Before the Bell: FOMC, Oil, Banks, and GameStop and AMC Return for an Encore",https://247wallst.com/investing/2023/03/22/before-the-bell-fomc-oil-banks-and-gamestop-and-amc-return-for-an-encore/,2023-03-22T11:33:10Z
101,LNT,Marketscreener.com,MarketScreener,Alliant Energy : New Financial Obligation - Form 8-K,https://www.marketscreener.com/quote/stock/ALLIANT-ENERGY-CORPORATIO-50060931/news/Alliant-Energy-New-Financial-Obligation-Form-8-K-43234080/?utm_medium=RSS&utm_content=20230313,2023-03-13T20:32:45Z
