,Company,Source,Author,Title,URL,Publish_Date
606,COP,Highsnobiety,Ana Calderon,You Can Still Cop the New Billie Eilish Air Force 1s Here,https://www.highsnobiety.com/p/white-nike-billie-eilish-air-force-1-buy-online/,2023-03-27T15:20:36Z
607,ED,Business Insider,gglover@insider.com (George Glover),"US stocks could end this year 14% higher because banking turmoil will trigger a Fed pause, veteran investor Ed Yardeni says",https://markets.businessinsider.com/news/stocks/stock-market-outlook-rally-banking-turmoil-fed-pause-ed-yardeni-2023-3,2023-03-30T11:06:09Z
608,ED,Business Insider,prosen@insider.com (Phil Rosen),The Nasdaq just entered a bull market as the Fed fuels tech stocks toward their second-best quarter in a decade,https://markets.businessinsider.com/news/stocks/nasdaq-bull-market-tech-stocks-fed-policy-svb-bank-crisis-2023-3,2023-03-30T13:20:58Z
609,ED,Business Insider,jsor@insider.com (Jennifer Sor),"Silicon Valley Bank's downfall was the result of Powell inflicting 'callous' and unnecessary pain on the economy, Nobel economist says",https://markets.businessinsider.com/news/stocks/silicon-valley-bank-collapse-fed-inflation-interest-rates-powell-economy-2023-3,2023-03-14T16:36:14Z
610,ED,Business Insider,Morgan Chittum,US stocks jump as traders put bank crisis behind them and brace for more inflation data,https://markets.businessinsider.com/news/stocks/stock-market-news-bank-crisis-sp500-nasdaq-inflation-recession-fed-2023-3,2023-03-30T20:05:22Z
611,ED,The Guardian,Graeme Wearden,Global markets gripped by Silicon Valley Bank collapse as banking shares slide – business live,https://www.theguardian.com/business/live/2023/mar/14/global-markets-silicon-valley-bank-collapse-banking-shares-boj-ecb-business-live,2023-03-14T08:01:03Z
612,STZ,24/7 Wall St.,Paul Ausick,Before the Bell: Nikola’s 90 Million New Shares; Bitcoin Sells Off; Facebook to Reject Political Ads in Europe?,https://247wallst.com/investing/2023/03/31/before-the-bell-nikolas-90-million-new-shares-bitcoin-sells-off-facebook-to-reject-political-ads-in-europe/,2023-03-31T11:36:06Z
613,STZ,CNBC,Paulina Likos,What are dual-class shares and why do they matter for investors like us?,https://www.cnbc.com/2023/03/13/what-are-dual-class-shares-and-why-they-matter-for-the-club.html,2023-03-13T17:03:10Z
614,STZ,Biztoc.com,benzinga.com,The Evolution Of Social Drinking: Beverage Companies Dip Their Toes Into Cannabis,https://biztoc.com/x/4e6c4ec1804c6f39,2023-03-20T20:02:21Z
615,STZ,Biztoc.com,cnbc.com,Jim Cramer's top 10 things to watch in the stock market Friday: Stars of first quarter and Alphabet's AI risk,https://biztoc.com/x/9078055c99ae8264,2023-03-31T13:54:04Z
616,STZ,Marketscreener.com,MarketScreener,"Constellation Brands to Report Full Fiscal Year and Fourth Quarter 2023 Financial Results; Host Conference Call April 6, 2023",https://www.marketscreener.com/quote/stock/CONSTELLATION-BRANDS-INC-14502/news/Constellation-Brands-to-Report-Full-Fiscal-Year-and-Fourth-Quarter-2023-Financial-Results-Host-Conf-43142697/?utm_medium=RSS&utm_content=20230302,2023-03-02T21:31:07Z
617,CEG,Yahoo Entertainment,TipRanks,The US may be on the brink of a nuclear renaissance; Here are 2 stocks under $5 that stand to benefit,https://finance.yahoo.com/news/us-may-brink-nuclear-renaissance-145603066.html,2023-03-15T14:56:03Z
618,CEG,Marketscreener.com,MarketScreener,"Cerro Grande Mining Corporation Announces its First Fiscal Quarter ended December 31, 2022 results compared to the same period in 2021",https://www.marketscreener.com/quote/stock/CERRO-GRANDE-MINING-CORPO-33624506/news/Cerro-Grande-Mining-Corporation-Announces-its-First-Fiscal-Quarter-ended-December-31-2022-results-c-43131168/?utm_medium=RSS&utm_content=20230302,2023-03-02T03:20:02Z
619,CEG,Marketscreener.com,MarketScreener,Constellation Energy : CEO Joe Dominguez Testifies Before Senate Energy and Natural Resources Committee,https://www.marketscreener.com/quote/stock/CONSTELLATION-ENERGY-CORP-131860757/news/Constellation-Energy-CEO-Joe-Dominguez-Testifies-Before-Senate-Energy-and-Natural-Resources-Commit-43216613/?utm_medium=RSS&utm_content=20230310,2023-03-10T21:05:09Z
620,CEG,Marketscreener.com,MarketScreener,"Constellation CEO to Call on Congress to Support Reliable, Zero-Carbon Nuclear Energy by Investing in Domestic Fuel Sources",https://www.marketscreener.com/quote/stock/CONSTELLATION-ENERGY-CORP-131860757/news/Constellation-CEO-to-Call-on-Congress-to-Support-Reliable-Zero-Carbon-Nuclear-Energy-by-Investing-i-43202575/?utm_medium=RSS&utm_content=20230309,2023-03-09T13:03:02Z
621,CEG,Marketscreener.com,MarketScreener,Constellation Starts Production at Nation's First One Megawatt Demonstration Scale Nuclear-Powered Clean Hydrogen Facility,https://www.marketscreener.com/quote/stock/CONSTELLATION-ENERGY-CORP-131860757/news/Constellation-Starts-Production-at-Nation-s-First-One-Megawatt-Demonstration-Scale-Nuclear-Powered-C-43180631/?utm_medium=RSS&utm_content=20230307,2023-03-07T13:04:02Z
622,COO,9to5Mac,Ben Lovejoy,"AAPL chief operating officer sells $30M stock, likely to pay taxes",https://9to5mac.com/2023/03/27/aapl-chief-operating-officer-sells-30m-stock-likely-to-pay-taxes/,2023-03-27T11:30:52Z
623,COO,VentureBeat,"Derek Zanutto, CapitalG","The good, the bad and the ugly: The world of data is changing",https://venturebeat.com/enterprise-analytics/the-good-the-bad-and-the-ugly-the-world-of-data-is-changing/,2023-03-04T21:10:00Z
624,COO,Motley Fool,newsfeedback@fool.com (Dave Kovaleski),Why Kohl's Stock Was Climbing on Thursday,https://www.fool.com/investing/2023/03/30/why-kohls-stock-was-climbing-on-thursday/,2023-03-30T18:20:10Z
625,COO,Yahoo Entertainment,Simply Wall St,COO & President Jeremy Langford Just Bought 7.3% More Shares In Artemis Gold Inc. (CVE:ARTG),https://finance.yahoo.com/news/coo-president-jeremy-langford-just-120313025.html,2023-03-19T12:03:13Z
626,COO,Yahoo Entertainment,Simply Wall St,Insider Buying: The The Descartes Systems Group Inc. (TSE:DSG) President & COO Just Bought 19% More Shares,https://finance.yahoo.com/news/insider-buying-descartes-systems-group-104316174.html,2023-03-15T10:43:16Z
627,CPRT,Yahoo Entertainment,Simply Wall St,"Should You Think About Buying Copart, Inc. (NASDAQ:CPRT) Now?",https://finance.yahoo.com/news/think-buying-copart-inc-nasdaq-153151669.html,2023-03-20T15:31:51Z
628,CPRT,Marketscreener.com,,Momentum Picks Q2 2023: 5 stocks for spring,https://www.marketscreener.com/news/latest/Momentum-Picks-Q2-2023-5-stocks-for-spring--43389799/?utm_medium=RSS&utm_content=20230331,2023-03-31T08:55:00Z
629,GLW,Motley Fool,newsfeedback@fool.com (Justin Pope),3 Dividend-Paying Tech Stocks to Buy in March,https://www.fool.com/investing/2023/03/22/3-dividend-paying-tech-stocks-to-buy-in-march/,2023-03-22T10:48:00Z
630,GLW,Forbes,"Trefis Team, Contributor, 
 Trefis Team, Contributor
 https://www.forbes.com/sites/greatspeculations/people/trefis/",Should You Buy Corning Stock Over Its Sector Peer?,https://www.forbes.com/sites/greatspeculations/2023/03/17/should-you-buy-corning-stock-over-its-sector-peer/,2023-03-17T10:00:00Z
631,GLW,Yahoo Entertainment,Simply Wall St,When Should You Buy Corning Incorporated (NYSE:GLW)?,https://finance.yahoo.com/news/buy-corning-incorporated-nyse-glw-195324098.html,2023-03-27T19:53:24Z
632,GLW,Biztoc.com,forbes.com,Should You Buy Corning Stock Over Its Sector Peer?,https://biztoc.com/x/af86520a11e45860,2023-03-17T10:04:07Z
633,GLW,24/7 Wall St.,Lee Jackson,7 Tech Stocks to Buy Now That Have a Higher Dividend Yield Than the S&P 500,https://247wallst.com/technology-3/2023/03/28/7-tech-stocks-to-buy-now-that-have-a-higher-dividend-yield-than-the-sp-500/,2023-03-28T13:48:24Z
634,CTVA,Motley Fool,newsfeedback@fool.com (Lee Samaha),3 Red Hot Industrial Stocks to Buy Hand Over Fist in March,https://www.fool.com/investing/2023/03/03/3-red-hot-industrial-stocks-to-buy-hand-over-fist/,2023-03-03T10:19:00Z
635,CTVA,Yahoo Entertainment,News Direct,Evogene Offers Stock Investors An Excellent Risk/Reward Ratio,https://finance.yahoo.com/news/evogene-offers-stock-investors-excellent-174500120.html,2023-03-21T17:45:00Z
636,CTVA,Marketscreener.com,MarketScreener,Corteva : Agriscience Announces Plant Breeding Innovation to Combat Corn Disease,https://www.marketscreener.com/quote/stock/CORTEVA-INC-59241389/news/Corteva-Agriscience-Announces-Plant-Breeding-Innovation-to-Combat-Corn-Disease-43213935/?utm_medium=RSS&utm_content=20230310,2023-03-10T13:45:11Z
637,CTVA,Marketscreener.com,MarketScreener,"Corteva Agriscience, Bunge and Chevron Announce Collaboration to Produce Winter Canola to Meet Growing Demand for Lower Carbon Renewable Fuels",https://www.marketscreener.com/quote/stock/BUNGE-LIMITED-11825/news/Corteva-Agriscience-Bunge-and-Chevron-Announce-Collaboration-to-Produce-Winter-Canola-to-Meet-Growi-43240314/?utm_medium=RSS&utm_content=20230314,2023-03-14T12:10:01Z
638,CTVA,Marketscreener.com,MarketScreener,Corteva : Agriscience and Bunge Announce Collaboration to Develop Amino Acid-Enhanced Soybeans,https://www.marketscreener.com/quote/stock/CORTEVA-INC-59241389/news/Corteva-Agriscience-and-Bunge-Announce-Collaboration-to-Develop-Amino-Acid-Enhanced-Soybeans-43202708/?utm_medium=RSS&utm_content=20230309,2023-03-09T13:15:43Z
639,CSGP,Hospitality Net,STR,Baird/STR Hotel Stock Index fell 2.5% in February,https://www.hospitalitynet.org/news/4115512.html,2023-03-20T14:07:00Z
640,CSGP,Marketscreener.com,MarketScreener,CoStar Group Announces Winners of 2023 CoStar Impact Awards,https://www.marketscreener.com/quote/stock/COSTAR-GROUP-INC-8923/news/CoStar-Group-Announces-Winners-of-2023-CoStar-Impact-Awards-43393675/?utm_medium=RSS&utm_content=20230331,2023-03-31T13:01:02Z
641,CSGP,Marketscreener.com,MarketScreener,Apartments.com Publishes February 2023 Rent Growth Report,https://www.marketscreener.com/quote/stock/COSTAR-GROUP-INC-8923/news/Apartments-com-Publishes-February-2023-Rent-Growth-Report-43194156/?utm_medium=RSS&utm_content=20230308,2023-03-08T18:01:02Z
642,COST,Gizmodo.com,Nikki Main,Googlers Will Enjoy Fewer Free Snacks and Workout Classes Under Fresh Cuts,https://gizmodo.com/google-snacks-alphabet-return-to-office-layoffs-ai-1850289576,2023-03-31T21:10:00Z
643,COST,Engadget,Billy Steele,Master & Dynamic gives its MH40 headphones new drivers and longer battery life,https://www.engadget.com/master-and-dynamic-gives-its-mh40-headphones-new-drivers-and-longer-battery-life-120001289.html,2023-03-14T12:00:01Z
644,COST,The Guardian,Graeme Wearden,UK house prices rose 1.1% in February; Greggs warns of cost inflation squeeze – business live,https://www.theguardian.com/business/live/2023/mar/07/uk-house-prices-rise-february-halifax-greggs-cost-inflation-squeeze-business-live,2023-03-07T07:48:59Z
645,COST,CNET,Nick Wolny,"For These Personal Finance Influencers, Infertility Wasn't Part of the Plan - CNET",https://www.cnet.com/personal-finance/fi-couple-infertility/,2023-03-13T18:32:02Z
646,COST,Wired,Varsha Bansal,SVB’s Collapse Is Causing Chaos in India’s Tech Sector,https://www.wired.com/story/svbs-collapse-is-causing-chaos-in-indias-tech-sector/,2023-03-13T21:00:00Z
647,CTRA,Investor's Business Daily,Investor's Business Daily,"Chevron, Exxon Mobil Falter As Oil Prices Skid To 15-Month Lows",https://www.investors.com/news/chevron-exxon-mobil-falter-as-oil-prices-hit-15-month-lows/,2023-03-15T18:28:27Z
648,CTRA,24/7 Wall St.,Lee Jackson,"Friday’s Top Analyst Upgrades and Downgrades: AMC Entertainment, APA, Chewy, FirstSolar, Marathon Oil, Match, Meta, Pioneer Natural Resources, Toast and More",https://247wallst.com/investing/2023/03/24/fridays-upgrades-downgrades-amc-entertainment-apa-chewy-coterra-energy-dynatrace-firstsolar-marathon-oil-match-meta-platforms-ovintiv-pioneer-natural-resources-sl-green-realty-toast/,2023-03-24T12:53:04Z
649,CTRA,Investor's Business Daily,Investor's Business Daily,9 Stocks With Upside Already Pay Treasury-Topping 4% Yields,https://www.investors.com/etfs-and-funds/sectors/sp500-stocks-with-upside-already-pay-treasury-topping-4-yields/,2023-03-08T13:00:51Z
650,CTRA,24/7 Wall St.,Lee Jackson,Bank Fears Could Make Oil Explode Higher and Buffett Is Buying: 5 Top Stocks With Huge Dividends,https://247wallst.com/investing/2023/03/29/bank-fears-could-make-oil-explode-higher-and-buffett-is-buying-5-top-stocks-with-huge-dividends/,2023-03-29T10:58:55Z
651,CTRA,24/7 Wall St.,Lee Jackson,"Monday’s Top Analyst Upgrades and Downgrades: Caterpillar, Charles Schwab, Chewy, Gap, GE, Marathon Petroleum, Marvell Technology, Roblox, SunPower and More",https://247wallst.com/investing/2023/03/13/monday-upgrades-downgrades-arista-networks-ballard-power-systems-caterpillar-charles-schwab-chewy-gap-general-electric-keycorp-marathon-petroleum-marvell-technology-roblox-sunpower-sunrun/,2023-03-13T12:54:50Z
652,CCI,Yahoo Entertainment,Soumya Eswaran,Should You Exit Crown Castle (CCI)?,https://finance.yahoo.com/news/exit-crown-castle-cci-114339322.html,2023-03-03T11:43:39Z
653,CCI,Motley Fool,newsfeedback@fool.com (Matthew DiLallo),3 Elite Dividend Stocks Down 30%+ to Buy Right Now for Decades of Passive Income,https://www.fool.com/investing/2023/03/15/3-elite-dividend-stocks-down-30-to-buy-right-now-f/,2023-03-15T11:45:00Z
654,CCI,Yahoo Entertainment,Soumya Eswaran,Higher Interest Rate Challenged Crown Castle (CCI) in Q4,https://finance.yahoo.com/news/higher-interest-rate-challenged-crown-094026395.html,2023-03-08T09:40:26Z
655,CCI,Motley Fool,newsfeedback@fool.com (Matthew DiLallo),4 Top Dividend Stocks Yielding 4%+ to Buy This March,https://www.fool.com/investing/2023/03/04/4-top-dividend-stocks-yielding-4-to-buy-this-march/,2023-03-04T12:09:00Z
656,CCI,Yahoo Entertainment,Navdeep Yadav,Coca-Cola And Pepsi Face New Threat In India As Country's Richest Person Revives Iconic Brand,https://finance.yahoo.com/news/coca-cola-pepsi-face-threat-114831176.html,2023-03-28T11:48:31Z
657,CSX,Forbes,"Trefis Team, Contributor, 
 Trefis Team, Contributor
 https://www.forbes.com/sites/greatspeculations/people/trefis/",Is Union Pacific Stock A Better Pick Over This Railroad Company?,https://www.forbes.com/sites/greatspeculations/2023/03/02/is-union-pacific-stock-a-better-pick-over-this-railroad-company/,2023-03-02T12:00:04Z
658,CSX,Forbes,"Trefis Team, Contributor, 
 Trefis Team, Contributor
 https://www.forbes.com/sites/greatspeculations/people/trefis/",What Led To A 25% Fall In CSX Stock Since 2021?,https://www.forbes.com/sites/greatspeculations/2023/03/27/what-led-to-a-25-fall-in-csx-stock-since-2021/,2023-03-27T10:00:55Z
659,CSX,MarketWatch,James Rogers,": Norfolk Southern committed to ‘making this right’ for East Palestine after Ohio derailment, CEO to tell senators",https://www.marketwatch.com/story/norfolk-southern-committed-to-making-this-right-for-east-palestine-after-ohio-derailment-ceo-to-tell-senators-32f1f840,2023-03-09T13:15:00Z
660,CSX,MarketWatch,Philip van Doorn,Deep Dive: These stocks fared the worst as Powell pushed the market down Tuesday,https://www.marketwatch.com/story/these-stocks-fared-the-worst-as-powell-pushed-the-market-down-tuesday-1744d0a,2023-03-07T21:59:00Z
661,CSX,Motley Fool,newsfeedback@fool.com (Jake Lerch),A Bull Market Is Coming: 3 Dividend Stocks to Buy Before the Next Rally,https://www.fool.com/investing/2023/03/07/a-bull-market-is-coming-3-dividend-stocks-to-buy-b/,2023-03-07T10:47:00Z
662,CMI,Yahoo Entertainment,Simply Wall St,Is Cummins Inc.'s (NYSE:CMI) Stock's Recent Performance Being Led By Its Attractive Financial Prospects?,https://finance.yahoo.com/news/cummins-inc-nyse-cmi-stocks-133026958.html,2023-03-04T13:30:26Z
663,CMI,CoinDesk,"Lyllah Ledesma, Omkar Godbole",First Mover Americas: Bitcoin Gains as FDIC Steps In for Silicon Valley Bank,https://www.coindesk.com/markets/2023/03/13/first-mover-americas-bitcoin-gains-as-fdic-steps-in-for-silicon-valley-bank/,2023-03-13T12:44:55Z
664,CMI,Yahoo Entertainment,PR Newswire,GCCL Develops PBMC Resource Management System,https://finance.yahoo.com/news/gccl-develops-pbmc-management-system-012600735.html,2023-03-17T01:26:00Z
665,CMI,The Times of India,ETMarkets.com,Stock market update: Nifty Realty index advances 0.3% in an upbeat market,https://economictimes.indiatimes.com/markets/stocks/stock-watch/stock-market-update-nifty-realty-index-advances-0-3-in-an-upbeat-market/articleshow/98897968.cms,2023-03-22T05:56:33Z
666,CMI,Yahoo Entertainment,"Sam Reynolds, David Z. Morris",First Mover Asia: Bitcoin Is Stuck Between Silvergate and China,https://finance.yahoo.com/news/first-mover-asia-bitcoin-stuck-010604652.html,2023-03-06T01:06:04Z
667,CVS,Motley Fool,newsfeedback@fool.com (Cory Renauer),Is CVS Health a Good Dividend Stock to Buy Now?,https://www.fool.com/investing/2023/03/06/is-cvs-health-a-good-dividend-stock-to-buy-now/,2023-03-06T10:41:00Z
668,CVS,Business Insider,pzaveri@insider.com (Paayal Zaveri),TikTok wants its advertisers to know the 'myths vs. facts' after its CEO's day in Congress,https://www.businessinsider.com/tiktok-ceo-advertisers-miami-crypto-apple-elon-musk-openai-2023-3,2023-03-28T10:30:00Z
669,CVS,Forbes,"Trefis Team, Contributor, 
 Trefis Team, Contributor
 https://www.forbes.com/sites/greatspeculations/people/trefis/",Is CVS Health Stock Undervalued?,https://www.forbes.com/sites/greatspeculations/2023/03/09/is-cvs-health-stock-undervalued/,2023-03-09T12:00:00Z
670,CVS,Motley Fool,"newsfeedback@fool.com (Parkev Tatevosian, CFA)",Best Dividend Stock to Buy: Walgreens vs. CVS,https://www.fool.com/investing/2023/03/20/best-dividend-stock-to-buy-walgreens-vs-cvs/,2023-03-20T13:33:27Z
671,CVS,Motley Fool,newsfeedback@fool.com (Alex Carchidi),Is Now a Smart Time to Buy the Dip in CVS Stock?,https://www.fool.com/investing/2023/03/31/is-now-a-smart-time-to-buy-the-dip-in-cvs-stock/,2023-03-31T12:20:00Z
672,DHI,Forbes,"Richard Henry Suttmeier, Contributor, 
 Richard Henry Suttmeier, Contributor
 https://www.forbes.com/sites/richardhenrysuttmeier/",Homebuilder Stocks Have Solid Gains Since Their June 2022 Lows. Three Of Five That I Follow Are Also In Correction Territory. Here’s How To Trade Them,https://www.forbes.com/sites/richardhenrysuttmeier/2023/03/06/homebuilder-stocks-have-solid-gains-since-their-june-2022-lows-three-of-five-that-i-follow-are-also-in-correction-territory-heres-how-to-trade-them/,2023-03-06T19:09:42Z
673,DHI,CNBC,Jeff Marks,Top 10 things the Club is watching in the stock market Monday,https://www.cnbc.com/2023/03/06/top-10-things-the-club-is-watching-in-the-stock-market-monday.html,2023-03-06T13:16:26Z
674,DHI,ValueWalk,Mauldin Economics,Is The Housing Market About To Crash?,https://www.valuewalk.com/is-the-housing-market-about-to-crash/,2023-03-20T18:34:10Z
675,DHI,24/7 Wall St.,Lee Jackson,"Tuesday’s Top Analyst Upgrades and Downgrades: Altria, Apple, GE, Pfizer, Silvergate, Tesla, Verizon and More",https://247wallst.com/investing/2023/03/07/tuesdays-top-analyst-upgrades-and-downgrades-altria-apple-dr-horton-equitrans-midstream-fortinet-general-electric-nextracker-palo-alto-networks-pfizer-silvergate-capital-tesla-verizon/,2023-03-07T13:46:07Z
676,DHI,Investopedia,Staff Author,Markets End Mixed With Banks Dominating the Session,https://www.investopedia.com/markets-end-mixed-with-banks-dominating-session-7254911,2023-03-13T21:54:34Z
677,DHR,Yahoo Entertainment,Simply Wall St,Danaher Corporation (NYSE:DHR) Stock Has Shown Weakness Lately But Financials Look Strong: Should Prospective Shareholders Make The Leap?,https://finance.yahoo.com/news/danaher-corporation-nyse-dhr-stock-110040703.html,2023-03-18T11:00:40Z
678,DHR,Yahoo Entertainment,Allan Sloan,Jack Welch's GE Legacy ended last week: R.I.P.,https://finance.yahoo.com/news/jack-welchs-ge-legacy-ended-last-week-rip-134345986.html,2023-03-15T13:43:45Z
679,DHR,Yahoo Entertainment,Simply Wall St,A Look At The Fair Value Of Danaher Corporation (NYSE:DHR),https://finance.yahoo.com/news/look-fair-value-danaher-corporation-110038103.html,2023-03-02T11:00:38Z
680,DHR,24/7 Wall St.,Lee Jackson,"Wednesday’s Top Analyst Upgrades and Downgrades: Alphabet, Foot Locker, Meta Platforms, New York Community Bancorp, Nvidia, Rio Tinto and More",https://247wallst.com/investing/2023/03/22/wednesdays-top-analyst-upgrades-and-downgrades-alphabet-danaher-emerson-electric-foot-locker-meta-platforms-new-york-community-bancorp-nvidia-prologis-rio-tinto-vornado-realty-trust/,2023-03-22T12:53:39Z
681,DHR,Vitalmtb.com,iceman2058,YT Launches the Updated DECOY CORE 4 and Introduces Bigger 720Wh Battery Option,https://www.vitalmtb.com/news/press-release/yt-decoy-core-4-ditch-shuttle,2023-03-08T15:00:00Z
682,DRI,Motley Fool,newsfeedback@fool.com (Motley Fool Transcribing),Oil-Dri Of America (ODC) Q2 2023 Earnings Call Transcript,https://www.fool.com/earnings/call-transcripts/2023/03/10/oil-dri-of-america-odc-q2-2023-earnings-call-trans/,2023-03-10T18:30:25Z
683,DRI,Motley Fool,newsfeedback@fool.com (Reuben Gregg Brewer),Stock Market Sell-Off: Is Darden Restaurants a Buy?,https://www.fool.com/investing/2023/03/26/stock-market-sell-off-is-darden-restaurants-a-buy/,2023-03-26T10:55:00Z
684,DRI,Motley Fool,newsfeedback@fool.com (Kody Kester),Is This Dividend Stock a Buy Right Now?,https://www.fool.com/investing/2023/03/29/is-this-dividend-stock-a-buy-right-now/,2023-03-29T09:05:00Z
685,DRI,Motley Fool,newsfeedback@fool.com (Jim Halley),Why Shares of MacroGenics Climbed Thursday,https://www.fool.com/investing/2023/03/16/why-shares-of-macrogenics-climbed-thursday/,2023-03-16T16:17:29Z
686,DRI,The Times of India,Rashmi Rajput,SC dismisses DRI's petition against three Adani Group subsidiaries,https://economictimes.indiatimes.com/news/india/sc-dismisses-dris-petition-against-three-adani-group-subsidiaries/articleshow/99046958.cms,2023-03-27T15:58:57Z
687,DVA,Yahoo Entertainment,Fahad Saleem,13 Most Undervalued Healthcare Stocks To Buy According To Hedge Funds,https://finance.yahoo.com/news/13-most-undervalued-healthcare-stocks-131913063.html,2023-03-04T13:19:13Z
688,DVA,Marketscreener.com,MarketScreener,DaVita Inc. to Participate in the Barclays 2023 Global Healthcare Conference,https://www.marketscreener.com/quote/stock/DAVITA-INC-12378/news/DaVita-Inc-to-Participate-in-the-Barclays-2023-Global-Healthcare-Conference-43233667/?utm_medium=RSS&utm_content=20230313,2023-03-13T19:36:04Z
689,DVA,Marketscreener.com,MarketScreener,"Medtronic, DaVita launch Mozarc Medical, aimed at introducing new solutions for patients with kidney failure",https://www.marketscreener.com/quote/stock/DAVITA-INC-12378/news/Medtronic-DaVita-launch-Mozarc-Medical-aimed-at-introducing-new-solutions-for-patients-with-kidney-43400329/?utm_medium=RSS&utm_content=20230401,2023-04-01T16:01:03Z
690,DVA,Yahoo Entertainment,Hamna Asim,13 Best Medical Stocks To Invest In,https://finance.yahoo.com/news/13-best-medical-stocks-invest-235023832.html,2023-03-29T23:50:23Z
691,DVA,Marketscreener.com,MarketScreener,Braskem S A : 2022 Annual Audited Financial Statements,https://www.marketscreener.com/quote/stock/BRASKEM-S-A-6493438/news/Braskem-S-A-2022-Annual-Audited-Financial-Statements-43316187/?utm_medium=RSS&utm_content=20230323,2023-03-23T06:13:07Z
692,DE,Business Insider,"avarma@insider.com (Anil Varma,Zinya Salfiti)","Fear of financial crisis unleashed chaos across markets this week. These 7 charts show how the shockwaves engulfed stocks, bonds, and commodities.",https://markets.businessinsider.com/news/stocks/svb-banking-crisis-financial-turmoil-stocks-volatility-bonds-oil-markets-2023-3,2023-03-17T10:09:03Z
693,DE,Business Insider,jsor@insider.com (Jennifer Sor),Here's why the US avoiding a recession would actually be a 'treacherous' scenario for the stock market,https://markets.businessinsider.com/news/stocks/us-economy-recession-no-landing-stocks-fed-inflation-interest-rates-2023-3,2023-03-03T13:59:47Z
694,DE,Business Insider,Phil Rosen,The Nasdaq 100 just entered a fresh bull market - and a top analyst says tech names look like the new safety trade,https://www.businessinsider.com/nasdaq-bull-market-tech-safety-trade-economy-fed-rate-hike-2023-3,2023-03-31T10:10:16Z
695,DE,The Guardian,Alex Hern Technology editor,Near 50% fall in Silvergate’s shares over FTX exposure prompts survival doubts,https://www.theguardian.com/technology/2023/mar/02/near-50-per-cent-fall-in-silvergate-shares-over-ftx-exposure-prompts-survival-doubts,2023-03-02T17:10:12Z
696,DE,Slashdot.org,msmash,Want To Impress Wall Street? Just Add Some AI,https://tech.slashdot.org/story/23/03/08/1636201/want-to-impress-wall-street-just-add-some-ai,2023-03-08T16:40:00Z
697,DAL,Forbes,"Trefis Team, Contributor, 
 Trefis Team, Contributor
 https://www.forbes.com/sites/greatspeculations/people/trefis/",Pick Either American Airlines Stock Or Its Peer – Both May Offer Similar Returns,https://www.forbes.com/sites/greatspeculations/2023/03/29/pick-either-american-airlines-stock-or-its-peer--both-may-offer-similar-returns/,2023-03-29T12:00:06Z
698,DAL,ESPN,Sean Allen,Rankings update: Who will step up with Kirill Kaprizov out?,https://www.espn.com/fantasy/hockey/story/_/id/35850668/espn-nhl-fantasy-hockey-rankings-update-minnesota-wild-kirill-kaprizov,2023-03-13T16:05:04Z
699,DAL,Motley Fool,newsfeedback@fool.com (Jason Hall and Tyler Crowe),"Airline Stocks Look Ultra-Cheap, but Consider This Advice Before Buying",https://www.fool.com/investing/2023/03/03/airline-stocks-look-ultra-cheap-but-consider-this/,2023-03-03T17:15:00Z
700,DAL,Motley Fool,"newsfeedback@fool.com (Daniel Foelber, Scott Levine, and Lee Samaha)",Buy the Dip: 3 Top Stocks for Patient Investors,https://www.fool.com/investing/2023/03/26/down-big-3-top-stocks-for-patient-investors-buy/,2023-03-26T09:15:00Z
701,DAL,Motley Fool,newsfeedback@fool.com (Rick Munarriz),Cathie Wood Goes Bargain Hunting: 3 Stocks She Just Bought,https://www.fool.com/investing/2023/03/28/cathie-wood-goes-bargain-hunting-3-stocks-she-just/,2023-03-28T14:30:00Z
